id,type,authors,year,title,venue,key_finding,relevance,theme
105,article,"Springer Nature",2025,Holistic optimization from concrete mixture to structural design under uncertainty,Data-Centric Engineering (Cambridge),"End-to-end framework from mix design to structural optimisation with uncertainty",medium,multi_objective
106,article,"Wikipedia/Literature",2024,Environmental impact of concrete,Wikipedia,"900 kg CO2/ton cement. Concrete responsible for ~8% of global CO2 emissions",medium,sustainability
107,article,"RMI",2024,Unleashing the Potential of LC3,Rocky Mountain Institute,"Policy and technology analysis for LC3 adoption and CO2 reduction potential",medium,sustainability
108,article,"Grainger/UIUC",2025,Recipe for success: Illinois Grainger Engineers introduce AI-optimized concrete,UIUC Engineering News,"Collaboration with Meta on AI-optimised concrete mixes via active learning",medium,inverse_design
109,article,"Springer Nature",2025,Concrete compressive strength classification using hybrid ML models and interactive GUI,Innovative Infrastructure Solutions,"LightGBM highest accuracy (0.931 Low, 0.865 Normal, 0.935 High) in classification",medium,ml_prediction
110,article,"Springer Nature",2025,Review of AI-assisted design of low-carbon cost-effective concrete toward carbon neutrality,Artificial Intelligence Review,"Comprehensive review of AI methods for sustainable concrete including VAE, GAN, BO",high,inverse_design
111,article,"ScienceDirect",2025,Design of sustainable mortar incorporating CDW through adaptive experiments accelerated by ML,ScienceDirect,"Single-task GP + BoTorch: 50% OPC reduction while maintaining 40 MPa target. 10x faster design",medium,inverse_design
112,article,"Various",2025,A comprehensive review: Numerical and ML approaches for predicting concrete properties,Materials (MDPI),"Reviews numerical, code-based, and ML modelling for fresh to long-term concrete properties",medium,ml_prediction
113,article,"Penn State",2020,"Predicting Concrete's Strength by Machine Learning",arXiv:2004.14407,"Early comprehensive ML comparison for concrete strength prediction",medium,ml_prediction
114,article,"Various",2025,Evaluating strength properties of HPC using ensemble and hybrid models with deep learning,Scientific Reports,"Deep ensemble models for HPC strength evaluation",medium,ml_prediction
115,article,"Springer Nature",2025,A robust LightGBM model for concrete tensile strength forecast,PMC,"LightGBM for tensile strength: robust prediction with uncertainty estimates",medium,ml_prediction
