id,type,authors,year,title,journal,relevance,theme
179,result,"Department of Finance",2025,"Ireland's Housing Crisis to Last Another 15 Years","DoF Analysis",Long-term supply deficit forecast,3
180,result,"Housing Agency",2021,"Part V Information and Resources","Housing Agency",Part V guidance and implementation,3
181,result,"SCSI",2025,"Real Costs of New Apartment Delivery 2025","SCSI Report",Apartment delivery cost analysis,3
182,method,"Efron, B. and Tibshirani, R.",1993,"An Introduction to the Bootstrap","Chapman & Hall",Bootstrap confidence interval methods,5
183,method,"Box, G. and Jenkins, G.",1976,"Time Series Analysis: Forecasting and Control","Holden-Day",ARIMA methodology,5
184,method,"Hamilton, J.",1994,"Time Series Analysis","Princeton University Press",Time series econometrics,5
185,method,"Hastie, T. et al.",2009,"The Elements of Statistical Learning (2nd ed.)","Springer",Machine learning methods overview,5
186,method,"Breiman, L.",2001,"Random Forests","Machine Learning",Random forest methodology,5
187,method,"Friedman, J.",2001,"Greedy Function Approximation: A Gradient Boosting Machine","Annals of Statistics",Gradient boosting methodology,5
188,method,"Chen, T. and Guestrin, C.",2016,"XGBoost: A Scalable Tree Boosting System","KDD Proceedings",XGBoost implementation,5
189,method,"Tibshirani, R.",1996,"Regression Shrinkage and Selection via the Lasso","Journal of the Royal Statistical Society B",Lasso regression methodology,5
190,method,"Hoerl, A. and Kennard, R.",1970,"Ridge Regression: Biased Estimation for Nonorthogonal Problems","Technometrics",Ridge regression methodology,5
191,result,"Fingal County Council",2024,"Development Contribution Scheme 2021-2025","FCC",Development contributions €28k/unit,3
192,result,"Dublin City Council",2024,"Development Contribution Scheme","DCC",DCC development contribution rates,3
193,result,"Cork County Council",2024,"Development Contribution Scheme","CCC",Cork development contributions,3
194,result,"ESRI",2023,"Quarterly Economic Commentary","ESRI",Economic outlook and construction sector,3
195,result,"CSO",2025,"Population and Migration Estimates","Central Statistics Office",Population growth driving demand,3
196,result,"Eurostat",2024,"House Price Index EU","Eurostat",International price comparison,3
197,result,"Turner and Townsend",2024,"International Construction Market Survey","Turner & Townsend",International construction cost comparison,3
198,result,"World Bank",2024,"Doing Business: Construction Permits","World Bank",International regulatory comparison,3
199,cross,"Glaeser, E. and Ward, B.",2009,"The Causes and Consequences of Land Use Regulation","Journal of Urban Economics",Regulatory constraints analysis,7
200,cross,"Autor, D.",2003,"Outsourcing at Will: The Contribution of Unjust Dismissal Doctrine","Quarterly Journal of Economics",Diff-in-diff methodology example,7
201,cross,"Brueckner, J.",2011,"Lectures on Urban Economics","MIT Press",Urban economics textbook,1
202,result,"Lyons, R.",2017,"Can Economic Incentives Stimulate Housing Supply?","SSRN Working Paper",Supply elasticity in Ireland,3
203,result,"Byrne, M. and Norris, M.",2018,"Procyclical Social Housing and the Crisis of Irish Housing Policy","Housing Policy Debate",Procyclical social housing Ireland,3
204,result,"O'Callaghan, C. and Lawton, P.",2016,"Temporary Spaces of Community-Led Urban Activism in Ireland","Cambridge Journal of Regions Economy and Society",Urban activism and planning,3
205,result,"Hearne, R.",2020,"Housing Shock: The Irish Housing Crisis and How to Solve It","Policy Press",Irish housing crisis analysis,3
206,result,"Mercille, J.",2015,"The Political Economy and Media Coverage of the European Economic Crisis","Routledge",Media and housing crisis narrative,3
207,result,"Regan, A. and Brazys, S.",2018,"Celtic Phoenix or Leprechaun Economics?","Journal of European Public Policy",Post-crisis Irish recovery,3
208,result,"Kemeny, J.",1995,"From Public Housing to the Social Market","Routledge",Housing tenure systems theory,6
209,result,"Malpass, P.",2005,"Housing and the Welfare State","Palgrave",Housing welfare state interaction,6
210,result,"Ronald, R.",2008,"The Ideology of Home Ownership","Palgrave",Homeownership ideology,6
211,cross,"Autor, D. et al.",2014,"Housing Market Spillovers","Journal of Finance",Housing spillover effects,7
212,cross,"Mian, A. and Sufi, A.",2009,"The Consequences of Mortgage Credit Expansion","Quarterly Journal of Economics",Credit expansion and housing,7
213,cross,"Mian, A. et al.",2013,"Household Balance Sheets, Consumption, and the Economic Slump","Quarterly Journal of Economics",Household balance sheet effects,7
214,cross,"Adelino, M. et al.",2015,"House Prices, Collateral, and Self-Employment","Journal of Financial Economics",Housing collateral effects,7
215,result,"National Competitiveness Council",2024,"Costs of Doing Business in Ireland","NCC",Business cost benchmarking,3
216,result,"Engineering Ireland",2024,"Engineers Ireland Infrastructure Report","EI",Infrastructure capacity assessment,3
217,result,"Irish Water",2024,"Capital Investment Plan","Uisce Eireann",Water infrastructure constraints,3
218,result,"EirGrid",2024,"Grid Development Strategy","EirGrid",Electricity infrastructure constraints,3
219,result,"Transport Infrastructure Ireland",2024,"National Roads Programme","TII",Transport infrastructure investment,3
220,result,"An Bord Pleanala",2024,"Annual Report","ABP",Planning decisions analysis,3
221,result,"OPR",2024,"Annual Report","Office of the Planning Regulator",Planning system oversight,3
222,result,"EPA",2024,"Water Quality in Ireland","EPA",Environmental constraints on development,3
223,cross,"Arnott, R. and Stiglitz, J.",1979,"Aggregate Land Rents, Expenditure on Public Goods","Quarterly Journal of Economics",Henry George theorem,7
224,cross,"George, H.",1879,"Progress and Poverty","Robert Schalkenbach Foundation",Land value taxation theory,7
225,cross,"Mirrlees, J. et al.",2011,"Tax by Design: The Mirrlees Review","Oxford University Press",Optimal land taxation,7
