id,authors,year,title,venue,url,tag,key_finding_1sentence
190,Pan S; Yang Q,2010,A survey on transfer learning,IEEE Transactions on Knowledge and Data Engineering,https://ieeexplore.ieee.org/document/5288526,methodology_ml,Transfer-learning framework relevant to 2006-09 vs 2022-24 regime transfer.
191,Sugiyama M; Kawanabe M,2012,Machine Learning in Non-Stationary Environments,MIT Press,https://mitpress.mit.edu/9780262017091/machine-learning-in-non-stationary-environments/,textbook_ml,Covariate-shift and concept-drift methods relevant to our out-of-sample regime.
192,Lipton Z; Wang Y; Smola A,2018,Detecting and correcting for label shift,ICML,https://proceedings.mlr.press/v80/lipton18a.html,methodology_ml,Handles label-prior shift between training and test windows.
193,Hand D,2006,Classifier technology and the illusion of progress,Statistical Science,https://projecteuclid.org/journals/statistical-science/volume-21/issue-1/Classifier-Technology-and-the-Illusion-of-Progress/10.1214/088342306000000060.full,methodology_ml,Warns that marginal model improvements often do not generalise to new data.
194,Fuster A; Goldsmith-Pinkham P; Ramadorai T; Walther A,2022,Predictably unequal,Journal of Finance,https://onlinelibrary.wiley.com/doi/10.1111/jofi.13090b,methodology_ml,Machine-learning mortgage-default models produce predictably unequal outcomes across groups.
195,Mullainathan S; Spiess J,2017,Machine learning an applied econometric approach,Journal of Economic Perspectives,https://www.aeaweb.org/articles?id=10.1257/jep.31.2.87,methodology_ml,Guidelines for applying ML in econometric problems focused on prediction not identification.
196,Athey S; Imbens G,2019,Machine learning methods that economists should know,Annual Review of Economics,https://www.annualreviews.org/doi/10.1146/annurev-economics-080217-053433,methodology_ml,Reviews econometric-ML methods for policy-prediction problems.
197,Chernozhukov V; Chetverikov D; Demirer M; Duflo E; Hansen C; Newey W; Robins J,2018,Double/debiased machine learning,Econometrics Journal,https://academic.oup.com/ectj/article/21/1/C1/5056401,methodology_ml,DML framework for combining ML with causal inference relevant to feature attribution.
198,Varian H,2014,Big data new tricks for econometrics,Journal of Economic Perspectives,https://www.aeaweb.org/articles?id=10.1257/jep.28.2.3,methodology_ml,Early econometric-ML primer covering trees forests and cross-validation.
199,Belloni A; Chernozhukov V; Hansen C,2014,High-dimensional methods and inference on structural and treatment effects,Journal of Economic Perspectives,https://www.aeaweb.org/articles?id=10.1257/jep.28.2.29,methodology_ml,High-dimensional selection methods relevant for metro-level feature selection.
200,Kleinberg J; Ludwig J; Mullainathan S; Obermeyer Z,2015,Prediction policy problems,American Economic Review P&P,https://www.aeaweb.org/articles?id=10.1257/aer.p20151023,methodology_ml,Distinguishes prediction problems (ours) from causal-inference problems in applied economics.
201,Reinhart C; Rogoff K,2008,Is the 2007 US subprime financial crisis so different,American Economic Review,https://www.aeaweb.org/articles?id=10.1257/aer.98.2.339,early_warning_null,Pre-crisis macro indicators for US in 2007 resembled those of past advanced-economy crises.
202,Borio C; Drehmann M,2009,Assessing the risk of banking crises revisited,BIS Quarterly Review,https://www.bis.org/publ/qtrpdf/r_qt0903e.htm,early_warning,Credit-to-GDP and property-price gaps jointly predict banking crises moderately well.
203,Alessi L; Detken C,2011,Quasi real time early warning indicators for costly asset price boom/bust cycles,European Journal of Political Economy,https://www.sciencedirect.com/science/article/abs/pii/S0176268011000401,early_warning,Real-time EW indicators for asset-price crashes have moderate AUC around 0.7-0.8.
204,Sarlin P,2013,On policymakers loss functions and the evaluation of early warning systems,Economics Letters,https://www.sciencedirect.com/science/article/abs/pii/S0165176513001006,early_warning,Threshold choice for EW systems must reflect asymmetric losses between missed crises and false alarms.
205,Lo Duca M; Peltonen T,2013,Assessing systemic risks and predicting systemic events,Journal of Banking and Finance,https://www.sciencedirect.com/science/article/pii/S0378426612002464,early_warning,Joint monitoring of domestic and global imbalances improves crisis-prediction performance.
206,Holopainen M; Sarlin P,2017,Toward robust early warning models,Quantitative Finance,https://www.tandfonline.com/doi/abs/10.1080/14697688.2017.1357972,early_warning,Ensemble of ML classifiers outperforms single models in EW crisis prediction.
207,Beutel J; List S; von Schweinitz G,2019,Does machine learning help us predict banking crises,Journal of Financial Stability,https://www.sciencedirect.com/science/article/pii/S1572308918303097,early_warning_null,ML methods do NOT significantly outperform logit in out-of-sample banking-crisis prediction.
208,Bluwstein K; Buckmann M; Joseph A; Kapadia S; Şimşek Ö,2023,Credit growth the yield curve and financial crisis prediction,Journal of International Economics,https://www.sciencedirect.com/science/article/pii/S0022199622001088,early_warning,Machine learning modestly beats logit at predicting financial crises out-of-sample.
209,Fouliard J; Howell M; Rey H,2021,Answering the Queen machine learning and financial crises,NBER Working Paper,https://www.nber.org/papers/w28302,early_warning,Ensemble learning produces meaningfully better 3-year crisis predictions than traditional models.
210,Joy M; Rusnak M; Smidkova K; Vasicek B,2017,Banking and currency crises,International Finance,https://onlinelibrary.wiley.com/doi/10.1111/infi.12097,early_warning,Credit to GDP and house prices jointly form the most useful EW set in emerging markets.
211,Detken C; Weeken O; Alessi L; Bonfim D; Boucinha M; Castro C; Frontczak S; Giordana G; Giese J; Jahn N; others,2014,Operationalising the countercyclical capital buffer,ESRB Occasional Paper,https://www.esrb.europa.eu/pub/pdf/occasional/20140630_occasional_paper_5.pdf,early_warning,EU regulatory guide to calibrating macroprudential EW thresholds.
212,Dell'Ariccia G; Igan D; Laeven L,2012,Credit booms and lending standards,Journal of Money Credit and Banking,https://onlinelibrary.wiley.com/doi/10.1111/j.1538-4616.2012.00491.x,credit_supply,Lending standards deteriorate during credit booms consistent with supply-driven mechanism.
213,Dell'Ariccia G; Laeven L; Suarez G,2017,Bank leverage and monetary policy's risk-taking channel,Journal of Finance,https://onlinelibrary.wiley.com/doi/10.1111/jofi.12467,credit_supply,Low interest rates cause banks to loosen lending standards.
214,Engelhardt G,2003,Nominal loss aversion housing equity constraints and household mobility,Journal of Urban Economics,https://www.sciencedirect.com/science/article/abs/pii/S0094119003000222,inventory,Loss aversion in the housing market reduces household mobility creating lock-in effects.
215,Andersen S; Badarinza C; Liu L; Marx J; Ramadorai T,2022,Reference dependence in the housing market,American Economic Review,https://www.aeaweb.org/articles?id=10.1257/aer.20200304,inventory,Reference-dependent seller behaviour in Denmark slows price adjustment during downturns.
216,Ferreira F; Gyourko J; Tracy J,2010,Housing busts and household mobility,Journal of Urban Economics,https://www.sciencedirect.com/science/article/abs/pii/S0094119010000768,inventory,Negative equity reduces household mobility by 30+ percent consequential for labour-market flow.
217,Fisher J; Gatzlaff D; Geltner D; Haurin D,2003,Controlling for the impact of variable liquidity in commercial real estate price indices,Real Estate Economics,https://onlinelibrary.wiley.com/doi/10.1111/1540-6229.00059,methodology_index,Liquidity corrections needed for transaction-based indices relevant to our outcome definition.
218,Geltner D; Miller N; Clayton J; Eichholtz P,2013,Commercial Real Estate Analysis and Investments (3rd ed),OnCourse Learning,https://www.oncourselearning.com/,textbook_re,Textbook treatment of real-estate cycles transferable to residential crash analysis.
219,Leamer E,2007,Housing is the business cycle,Proceedings of Jackson Hole,https://www.kansascityfed.org/documents/3056/2007-Housing%20IS%20the%20Business%20Cycle.pdf,macro,Residential investment downturn leads every post-war US recession except one.
220,Ghent A; Owyang M,2010,Is housing the business cycle,Journal of Money Credit and Banking,https://onlinelibrary.wiley.com/doi/10.1111/j.1538-4616.2010.00315.x,macro,Leamer's thesis holds at national level but not at metro level where correlations are weaker.
221,Del Negro M; Otrok C,2007,99 Luftballons monetary policy and the house price boom across US states,Journal of Monetary Economics,https://www.sciencedirect.com/science/article/abs/pii/S0304393207000876,macro,Monetary policy plays small role in state-level price boom factor models.
222,Glaeser E; Kahn M,2010,The greenness of cities,Journal of Urban Economics,https://www.sciencedirect.com/science/article/abs/pii/S009411900900099X,supply_elasticity,Zoning stringency correlates with metro-level environmental outcomes and housing supply.
223,Gyourko J; Molloy R,2015,Regulation and housing supply,Handbook of Regional and Urban Economics,https://www.sciencedirect.com/science/article/pii/B9780444595317000164,supply_elasticity,Comprehensive review of land-use-regulation measurement and its effect on supply elasticity.
224,Gyourko J; Saiz A; Summers A,2008,A new measure of the local regulatory environment,Urban Studies,https://journals.sagepub.com/doi/10.1177/0042098007087341,supply_elasticity,Introduces the Wharton Residential Land Use Regulatory Index widely used as a supply-constraint proxy.
225,Hsieh C; Moretti E,2019,Housing constraints and spatial misallocation,American Economic Journal Macroeconomics,https://www.aeaweb.org/articles?id=10.1257/mac.20170388,supply_elasticity,Housing constraints in SF NY and San Jose reduced aggregate US GDP by 3.7 percent.
226,Paciorek A,2013,Supply constraints and housing market dynamics,Journal of Urban Economics,https://www.sciencedirect.com/science/article/abs/pii/S0094119013000259,supply_elasticity,Supply constraints amplify both the level and volatility of metro house prices.
227,Diamond R,2016,The determinants and welfare implications of US workers' diverging location choices by skill,American Economic Review,https://www.aeaweb.org/articles?id=10.1257/aer.20131706,supply_elasticity,Housing-supply elasticity differentials drove the skill-based geographic sorting 1980-2000.
228,Ganong P; Shoag D,2017,Why has regional income convergence in the US declined,Journal of Urban Economics,https://www.sciencedirect.com/science/article/pii/S0094119017300876,supply_elasticity,Land-use regulation in high-income metros has halted US regional income convergence.
229,Howard G,2020,The migration accelerator,American Economic Journal Macroeconomics,https://www.aeaweb.org/articles?id=10.1257/mac.20180197,supply_elasticity,Migration responds to local economic shocks amplified by inelastic housing supply.
230,Calder-Wang S,2021,The distributional impact of the sharing economy on the housing market,Working Paper Wharton,https://home.caldewang.com/,supply_elasticity,Airbnb-driven demand raised prices in high-elasticity supply metros.
231,Garcia D,2022,Second-home buyers and the housing boom and bust,Real Estate Economics,https://onlinelibrary.wiley.com/doi/10.1111/1540-6229.12328,speculation,Second-home and investor-buyer shares predict metro-level price volatility in 2000s and 2020s.
232,Cvijanović D; Spaenjers C,2021,We'll always have Paris,Management Science,https://pubsonline.informs.org/doi/10.1287/mnsc.2020.3838,speculation,Foreign second-home buyers affect high-end segment prices in global cities.
233,Badarinza C; Ramadorai T,2018,Home away from home safe haven effects and London house prices,Journal of Financial Economics,https://www.sciencedirect.com/science/article/pii/S0304405X18300771,speculation,Foreign capital flight during home-country crises raises London prices consistent with safe-haven demand.
234,Sá F,2015,The effect of foreign investors on local housing markets,CEPR Discussion Paper,https://cepr.org/publications/dp10899,speculation,Foreign buyer surges raised UK house prices particularly at the top of the distribution.
235,Saiz A,2007,Immigration and housing rents in American cities,Journal of Urban Economics,https://www.sciencedirect.com/science/article/abs/pii/S0094119006000842,demographics,Immigration shocks causally raise rents and prices by 1 percent per 1 percent population increase.
236,Hanushek E; Quigley J,1980,What is the price elasticity of housing demand,Review of Economics and Statistics,https://www.jstor.org/stable/1924794,demographics,Classical estimate of housing-demand income and price elasticities.
237,Poterba J,1991,House price dynamics the role of tax policy and demography,Brookings Papers on Economic Activity,https://www.brookings.edu/articles/house-price-dynamics-the-role-of-tax-policy-and-demography/,demographics,Demographic cohort shifts drove 1980s house-price dynamics.
238,Mankiw N G; Weil D,1989,The baby boom the baby bust and the housing market,Regional Science and Urban Economics,https://www.sciencedirect.com/science/article/abs/pii/0166046289900058,demographics,Famous (and famously wrong) demographic forecast of 1990s price declines cautionary tale.
239,Engelhardt G; Poterba J,1991,House prices and demographic change,Regional Science and Urban Economics,https://www.sciencedirect.com/science/article/abs/pii/016604629190037P,demographics,Mankiw-Weil critique showing demographic effects on prices are much smaller than claimed.
240,Green R; Hendershott P,1996,Age housing demand and real house prices,Regional Science and Urban Economics,https://www.sciencedirect.com/science/article/abs/pii/0166046295020795,demographics,Re-estimation confirms smaller demographic price effects and their state-level heterogeneity.
241,Myers D; Pitkin J,2009,Demographic forces and housing demand,Housing Policy Debate,https://www.tandfonline.com/doi/abs/10.1080/10511482.2009.9521366,demographics,Updated demographic forecasts for post-2008 era housing demand.
242,Goodman L; Mayer C,2018,Homeownership and the American dream,Journal of Economic Perspectives,https://www.aeaweb.org/articles?id=10.1257/jep.32.1.31,demographics,Reviews post-2008 homeownership trends and policy responses.
243,Begley J; Chan S,2018,Minority neighborhoods and the housing cycle,Journal of Urban Economics,https://www.sciencedirect.com/science/article/pii/S0094119018301001,demographics,Minority neighbourhoods showed sharper boom-bust cycles particularly in subprime-heavy metros.
244,Wachter S,2018,Credit risk cycles and the subprime crisis,Journal of Money Credit and Banking,https://onlinelibrary.wiley.com/doi/10.1111/jmcb.12487,credit_supply,Reviews how credit-risk underwriting cycles align with housing cycles.
245,Geanakoplos J,2010,The leverage cycle,NBER Macroeconomics Annual,https://www.nber.org/chapters/c11786,theory,Leverage-cycle theory linking margin requirements to asset-price booms and crashes.
246,Brunnermeier M; Pedersen L,2009,Market liquidity and funding liquidity,Review of Financial Studies,https://academic.oup.com/rfs/article/22/6/2201/1592167,theory,Liquidity spirals between asset and funding markets generate crisis amplification.
247,Adrian T; Shin H,2010,Liquidity and leverage,Journal of Financial Intermediation,https://www.sciencedirect.com/science/article/abs/pii/S104295730800046X,theory,Balance-sheet channel linking broker-dealer leverage to asset-price volatility.
248,Shleifer A; Vishny R,2011,Fire sales in finance and macroeconomics,Journal of Economic Perspectives,https://www.aeaweb.org/articles?id=10.1257/jep.25.1.29,theory,Fire-sale mechanism relevant for foreclosure-driven price declines.
249,Eggertsson G; Krugman P,2012,Debt deleveraging and the liquidity trap,Quarterly Journal of Economics,https://academic.oup.com/qje/article/127/3/1469/1859329,theory,Household-deleveraging zero-lower-bound model of post-2008 recession.
250,Guerrieri V; Lorenzoni G,2017,Credit crises precautionary savings and the liquidity trap,Quarterly Journal of Economics,https://academic.oup.com/qje/article/132/3/1427/3789288,theory,Credit crises produce precautionary saving consistent with post-2008 housing-market weakness.
251,Korinek A; Simsek A,2016,Liquidity trap and excessive leverage,American Economic Review,https://www.aeaweb.org/articles?id=10.1257/aer.20140289,theory,Private leverage is inefficiently high in zero-lower-bound economies.
252,Bianchi J; Mendoza E,2018,Optimal time-consistent macroprudential policy,Journal of Political Economy,https://www.journals.uchicago.edu/doi/10.1086/696280,theory,Optimal macroprudential policy trades off crisis probability and growth.
253,Farhi E; Werning I,2016,A theory of macroprudential policies in the presence of nominal rigidities,Econometrica,https://onlinelibrary.wiley.com/doi/10.3982/ECTA11883,theory,Macroprudential policy rationale in Keynesian settings.
254,Jordà Ò; Schularick M; Taylor A,2017,Macrofinancial history and the new business cycle facts,NBER Macroeconomics Annual,https://www.nber.org/chapters/c13776,macro,New long-run dataset used in related crisis-prediction research.
255,Baron M; Xiong W,2017,Credit expansion and neglected crash risk,Quarterly Journal of Economics,https://academic.oup.com/qje/article/132/2/713/3074537,credit_supply,Investors systematically underestimate crash risk during credit booms.
256,Baron M; Verner E; Xiong W,2021,Banking crises without panics,Quarterly Journal of Economics,https://academic.oup.com/qje/article/136/1/51/5902836,credit_supply,New long-run dataset of banking crises with and without panic runs.
257,Abildgren K; Hansen N; Kuchler A,2018,Overoptimism and house price bubbles,Journal of Behavioral and Experimental Finance,https://www.sciencedirect.com/science/article/pii/S2214635017301272,behavioural,Danish survey evidence on overoptimism before housing peaks.
858,Chinloy P,1996,Real estate cycles,Real Estate Economics,https://onlinelibrary.wiley.com/doi/10.1111/1540-6229.00681,macro,Real-estate cycles exhibit shorter periodicity than business cycles with regional heterogeneity.
259,Wheaton W,1999,Real estate cycles some fundamentals,Real Estate Economics,https://onlinelibrary.wiley.com/doi/10.1111/1540-6229.00772,macro,Supply-side lags generate endogenous real-estate price-construction cycles.
260,DiPasquale D; Wheaton W,1994,Housing market dynamics and the future of housing prices,Journal of Urban Economics,https://www.sciencedirect.com/science/article/abs/pii/S0094119084710028,macro,Four-quadrant model of housing and asset-market dynamics foundational to real-estate macro.
261,Lustig H; Van Nieuwerburgh S,2005,Housing collateral consumption insurance and risk premia,Journal of Finance,https://onlinelibrary.wiley.com/doi/10.1111/j.1540-6261.2005.00759.x,macro,Housing collateral provides consumption insurance relevant to risk-premium modelling.
262,Bracke P,2015,House prices and rents micro evidence from a matched data set,Regional Science and Urban Economics,https://www.sciencedirect.com/science/article/pii/S0166046215000198,price_fundamentals,Matched data show large price-rent-ratio heterogeneity within cities.
263,Sommer K; Sullivan P; Verbrugge R,2013,The equilibrium effect of fundamentals on house prices and rents,Journal of Monetary Economics,https://www.sciencedirect.com/science/article/pii/S0304393213001025,price_fundamentals,Structural equilibrium model attributes ~half of 2000s price-rent-ratio rise to fundamentals.
264,Garriga C; Hedlund A,2020,Mortgage debt consumption and illiquid housing markets,American Economic Review,https://www.aeaweb.org/articles?id=10.1257/aer.20170572,credit_supply,Structural model linking mortgage-rate shocks to house-price and consumption responses.
265,Ortalo-Magné F; Rady S,2006,Housing market dynamics on the contribution of income shocks and credit constraints,Review of Economic Studies,https://academic.oup.com/restud/article/73/2/459/1539064,credit_supply,Income shocks to young households amplified by credit constraints drive price cycles.
266,Stein J,1995,Prices and trading volume in the housing market,Quarterly Journal of Economics,https://academic.oup.com/qje/article/110/2/379/1861884,inventory,Down-payment constraints explain positive price-volume correlation during downturns.
267,Wong M,2020,September 11 and housing cycle,Review of Economics and Statistics,https://direct.mit.edu/rest/article/102/2/341/58575,demographics,Immigration-driven demand shocks persistent effects on metro prices.
268,Gabriel S; Nothaft F,2001,Rental housing markets the incidence and duration of vacancy and the natural vacancy rate,Journal of Urban Economics,https://www.sciencedirect.com/science/article/abs/pii/S0094119000921757,inventory,Natural-vacancy-rate estimation framework transferable to owner-occupied inventory.
269,Smith B; Rosen K; Fallis G,1988,Recent developments in economic models of housing markets,Journal of Economic Literature,https://www.jstor.org/stable/2726432,review,Classic review of housing-market models covering supply-demand-construction dynamics.
270,Quigley J,1999,Real estate prices and economic cycles,International Real Estate Review,https://web.ntpu.edu.tw/~guanchi/content/9/2/05.pdf,review,Review of cyclical real-estate models including supply lags and land-market frictions.
271,Goetzmann W,1993,The single-family home in the investment portfolio,Journal of Real Estate Finance and Economics,https://link.springer.com/article/10.1007/BF01096969,methodology_index,Single-family-home portfolio-risk analysis using repeat-sales indices.
272,Goetzmann W; Spiegel M,1995,Non-temporal components of residential real estate appreciation,Review of Economics and Statistics,https://www.jstor.org/stable/2109881,methodology_index,Decomposes price appreciation into temporal and cross-sectional components.
273,Bogin A; Doerner W; Larson W,2019,Local house price dynamics new indices and stylized facts,Real Estate Economics,https://onlinelibrary.wiley.com/doi/10.1111/1540-6229.12233,methodology_index,FHFA county-level HPI construction and stylised facts about local dynamics.
274,Bogin A; Doerner W; Larson W,2019,Missing the mark house price index accuracy and mortgage credit modeling,Real Estate Economics,https://onlinelibrary.wiley.com/doi/10.1111/1540-6229.12198,methodology_index,HPI measurement error has material effects on LTV and default-model predictions.
275,Guerrieri V; Hartley D; Hurst E,2013,Endogenous gentrification and housing price dynamics,Journal of Public Economics,https://www.sciencedirect.com/science/article/pii/S0047272712000667,demographics,Within-metro gentrification flows create sub-metro price-dynamics heterogeneity.
276,Rosenthal S,2014,Are private markets and filtering a viable source of low-income housing,American Economic Review,https://www.aeaweb.org/articles?id=10.1257/aer.104.2.687,supply_elasticity,Filtering dynamics affect the low end of metro price distribution.
277,McMillen D,2008,Changes in spatial distribution of house prices in Chicago,Journal of Urban Economics,https://www.sciencedirect.com/science/article/abs/pii/S0094119007000964,demographics,Spatial-quantile analysis of within-metro price changes pre-crisis.
278,Zillow Research,2024,The housing market is still unaffordable,Zillow Research Blog,https://www.zillow.com/research/,cycle_2022,Empirical documentation of 2021-23 affordability deterioration across US metros.
279,Kiel K; Zabel J,1999,The accuracy of owner-provided house values,Real Estate Economics,https://onlinelibrary.wiley.com/doi/10.1111/1540-6229.00781,methodology_index,Owner-reported values miscalibrated in booms (over-stated) and busts (under-stated).
280,Dorsey R; Hu H; Mayer W; Wang H,2010,Hedonic versus repeat-sales housing price indexes,Journal of Housing Economics,https://www.sciencedirect.com/science/article/abs/pii/S1051137709000473,methodology_index,Hedonic and repeat-sales indices diverge more in volatile markets complicating crash definition.
281,Leamer E,2015,Housing really is the business cycle,Journal of Money Credit and Banking,https://onlinelibrary.wiley.com/doi/10.1111/jmcb.12246,macro,Updated version of Leamer's business-cycle-housing thesis with post-2008 data.
282,Ghent A; Valkanov R,2016,Comparing securitized and balance sheet loans,Journal of Urban Economics,https://www.sciencedirect.com/science/article/pii/S0094119016300249,credit_supply,Securitised and balance-sheet loans differ in performance contrary to Keys-Seru-Vig simple story.
283,Cherkes M; Sagi J; Stanton R,2009,A liquidity-based theory of closed-end funds,Review of Financial Studies,https://academic.oup.com/rfs/article/22/1/257/1592047,theory,Liquidity-premium framework transferable to housing liquidity analysis.
284,Case K; Mayer C,1996,Housing price dynamics within a metropolitan area,Regional Science and Urban Economics,https://www.sciencedirect.com/science/article/abs/pii/0166046295020866,price_fundamentals,Sub-metro price heterogeneity relates to demographics employment and amenities.
285,Karoly L; Panis C,2004,The 21st Century at Work,RAND Corporation,https://www.rand.org/pubs/monographs/MG164.html,demographics,Labor force projections relevant to long-run metro housing demand.
286,White M,2009,Bankruptcy personal responsibility and the 2008 financial crisis,National Tax Journal,https://www.journals.uchicago.edu/doi/10.17310/ntj.2009.3.04,credit_supply,Bankruptcy-law interactions with mortgage default during the crisis.
