id,authors,year,title,venue,url,tag,key_finding_1sentence
93,Flavin M; Nakagawa S,2008,A model of housing in the presence of adjustment costs,American Economic Review,https://www.aeaweb.org/articles?id=10.1257/aer.98.1.474,behavioural,Adjustment costs produce infrequent reoptimisation explaining smooth but occasionally large price adjustments.
94,Piazzesi M; Schneider M; Tuzel S,2007,Housing consumption and asset pricing,Journal of Financial Economics,https://www.sciencedirect.com/science/article/pii/S0304405X06001826,price_fundamentals,Housing share of consumption is a pricing factor for equities and housing returns alike.
95,Nakamura E; Steinsson J,2014,Fiscal stimulus in a monetary union,American Economic Review,https://www.aeaweb.org/articles?id=10.1257/aer.104.3.753,macro,Cross-state variation used in related housing studies for identifying regional multipliers.
96,Chaney T; Sraer D; Thesmar D,2012,The collateral channel,American Economic Review,https://www.aeaweb.org/articles?id=10.1257/aer.102.6.2381,credit_supply,Firm-level real-estate collateral amplifies local investment responses to price shocks.
97,Cvijanovic D,2014,Real estate prices and firm capital structure,Review of Financial Studies,https://academic.oup.com/rfs/article/27/9/2690/1603533,credit_supply,Corporate leverage rises with local real-estate prices via the collateral channel.
98,Loutskina E; Strahan P,2015,Financial integration housing and economic volatility,Journal of Financial Economics,https://www.sciencedirect.com/science/article/pii/S0304405X15000197,credit_supply,Financial integration increased US local housing volatility by loosening the marginal-cost-of-funds constraint.
99,Landvoigt T,2017,Housing demand during the boom,Journal of Money Credit and Banking,https://onlinelibrary.wiley.com/doi/10.1111/jmcb.12432,credit_supply,Loosened credit standards more than interest-rate declines drove the 2000s demand shift.
100,Greenwood R; Hanson S; Shleifer A; Sørensen J,2022,Predictable financial crises,Journal of Finance,https://onlinelibrary.wiley.com/doi/10.1111/jofi.13090,early_warning,Crisis risk is predictably elevated when credit and asset prices boom jointly 40 percent conditional hit rate.
101,Jordà Ò; Schularick M; Taylor A,2015,Leveraged bubbles,Journal of Monetary Economics,https://www.sciencedirect.com/science/article/pii/S0304393215000537,early_warning,Asset-price bubbles are far more damaging when accompanied by a credit boom than when not.
102,Jordà Ò; Schularick M; Taylor A,2016,The great mortgaging housing finance crises and business cycles,Economic Policy,https://academic.oup.com/economicpolicy/article/31/85/107/2918426,credit_supply,Mortgage-credit growth is the single best predictor of financial crises in a long cross-country panel.
103,Cerutti E; Claessens S; Laeven L,2017,The use and effectiveness of macroprudential policies,Journal of Financial Stability,https://www.sciencedirect.com/science/article/pii/S1572308915001163,macro,Macroprudential tools modestly reduce credit growth and house-price inflation cross-country.
104,Laufer S,2018,Equity extraction and mortgage default,Review of Economic Dynamics,https://www.sciencedirect.com/science/article/pii/S1094202517301023,credit_supply,Equity extraction in 2004-06 strongly predicted 2008-09 default within metros.
105,Charles K; Hurst E; Notowidigdo M,2018,Housing booms and busts labor market opportunities,Journal of Political Economy,https://www.journals.uchicago.edu/doi/10.1086/697614,macro,Housing booms reduce college enrolment via low-skill construction wages reversed in the bust.
106,Mian A; Sufi A,2018,Finance and business cycles,Journal of Economic Perspectives,https://www.aeaweb.org/articles?id=10.1257/jep.32.3.31,credit_supply,Household-debt booms reliably precede recessions via a consumption-demand channel.
107,Kiyotaki N; Moore J,1997,Credit cycles,Journal of Political Economy,https://www.journals.uchicago.edu/doi/10.1086/262072,theory,Collateral feedback generates persistent credit cycles a foundational theoretical mechanism.
108,Bernanke B; Gertler M; Gilchrist S,1999,The financial accelerator in a quantitative business cycle framework,Handbook of Macroeconomics,https://www.sciencedirect.com/science/article/pii/S1574004899100343,theory,Financial-accelerator mechanism by which price declines amplify real-economy downturns.
109,Iacoviello M,2005,House prices borrowing constraints and monetary policy in the business cycle,American Economic Review,https://www.aeaweb.org/articles?id=10.1257/0002828054201477,theory,DSGE model with housing collateral widely used as a framework for modern housing-macro analyses.
110,Iacoviello M; Neri S,2010,Housing market spillovers,American Economic Journal Macroeconomics,https://www.aeaweb.org/articles?id=10.1257/mac.2.2.125,theory,Quantifies residential-investment and consumption spillovers from housing shocks.
111,Corbae D; Quintin E,2019,Mortgage innovation and the foreclosure crisis,NBER Working Paper,https://www.nber.org/papers/w25684,credit_supply,New mortgage products explain most of the foreclosure spike in structural model.
112,Keys B; Piskorski T; Seru A; Vig V,2013,Mortgage financing in the housing boom and bust,In Housing and the Financial Crisis NBER,https://www.nber.org/chapters/c12620,credit_supply,Securitisation lowered screening incentives and expanded credit at lower-quality margin.
113,Keys B; Mukherjee T; Seru A; Vig V,2010,Did securitization lead to lax screening,Quarterly Journal of Economics,https://academic.oup.com/qje/article/125/1/307/1881266,credit_supply,Causal evidence that securitisation reduced lender screening at the FICO-620 discontinuity.
114,Nadauld T; Sherlund S,2013,The impact of securitization on the expansion of subprime credit,Journal of Financial Economics,https://www.sciencedirect.com/science/article/pii/S0304405X13000974,credit_supply,Subprime securitisation expanded non-agency mortgage supply and share of risky originations.
115,Agarwal S; Amromin G; Ben-David I; Chomsisengphet S; Evanoff D,2014,Predatory lending and the subprime crisis,Journal of Financial Economics,https://www.sciencedirect.com/science/article/pii/S0304405X14001019,credit_supply,HUD-predatory-lending law effectively reduced high-risk originations with measurable ex-post default declines.
116,Agarwal S; Chang Y; Yavas A,2012,Adverse selection in mortgage securitization,Journal of Financial Economics,https://www.sciencedirect.com/science/article/pii/S0304405X11002893,credit_supply,Evidence that securitising banks retained higher-quality loans consistent with adverse selection.
117,Piskorski T; Seru A,2021,Mortgage market design,Annual Review of Financial Economics,https://www.annualreviews.org/doi/10.1146/annurev-financial-111620-023036,review,Reviews US mortgage market design and its fragility during housing downturns.
118,Palmer C,2015,Why did so many subprime borrowers default during the crisis,Working Paper MIT,https://mitsloan.mit.edu/shared/ods/documents/?PublicationDocumentID=4196,credit_supply,House-price declines not loan quality account for majority of increased default.
119,Gyourko J; Mayer C; Sinai T,2013,Superstar cities,American Economic Journal Economic Policy,https://www.aeaweb.org/articles?id=10.1257/pol.5.4.167,supply_elasticity,Inelastic-supply high-amenity metros show persistently faster price growth than the median metro.
120,Hilber C; Vermeulen W,2016,The impact of supply constraints on house prices in England,Economic Journal,https://academic.oup.com/ej/article/126/591/358/5077824,supply_elasticity,English price response to income shocks is 3x larger in most-regulated than least-regulated markets.
121,Molloy R; Nathanson C; Paciorek A,2022,Housing supply and affordability,Journal of Urban Economics,https://www.sciencedirect.com/science/article/pii/S0094119021000747,supply_elasticity,Reexamines Saiz elasticities and finds evidence they have become more inelastic over time.
122,Baum-Snow N; Han L,2024,The microgeography of housing supply,Journal of Political Economy,https://www.journals.uchicago.edu/doi/10.1086/728978,supply_elasticity,Tract-level supply elasticities vary dramatically within metros complicating metro-level elasticity claims.
123,Aastveit K; Anundsen A,2022,Asymmetric effects of monetary policy in regional housing markets,American Economic Journal Macroeconomics,https://www.aeaweb.org/articles?id=10.1257/mac.20190011,interest_rates,Monetary-policy house-price responses are state-dependent and 2x larger in supply-inelastic metros.
124,Huber K,2023,Are bigger banks better,Journal of Monetary Economics,https://www.sciencedirect.com/science/article/pii/S0304393222001179,credit_supply,Bank-size effects on local lending relevant for modelling housing credit geography.
125,Landvoigt T; Piazzesi M; Schneider M,2023,The housing boom and bust revisited,NBER Working Paper,https://www.nber.org/papers/w31280,credit_supply,Updated evidence that low-credit-score borrowers drove a disproportionate share of 2000s price growth.
126,Acolin A; Bricker J; Calem P; Wachter S,2016,Borrowing constraints and homeownership,American Economic Review P&P,https://www.aeaweb.org/articles?id=10.1257/aer.p20161084,credit_supply,Tighter post-2008 credit standards reduced homeownership by 5-10 percentage points.
127,Li W; Yao R,2007,The life-cycle effects of house price changes,Journal of Money Credit and Banking,https://onlinelibrary.wiley.com/doi/10.1111/j.1538-4616.2007.00064.x,macro,Life-cycle consumption effects of house-price shocks heterogeneous by age and tenure status.
128,Case K; Shiller R,1988,The behavior of home buyers in boom and post-boom markets,New England Economic Review,https://www.bostonfed.org/publications/new-england-economic-review/1988/the-behavior-of-home-buyers-in-boom-and-post-boom-markets.aspx,behavioural,Early survey evidence that backward-looking extrapolation dominates homebuyer expectations.
129,Case K; Shiller R,1990,Forecasting prices and excess returns in the housing market,Real Estate Economics,https://onlinelibrary.wiley.com/doi/10.1111/1540-6229.00521,momentum,Price momentum is statistically and economically large at 12-month horizons in US metros.
130,Meese R; Wallace N,2003,House price dynamics and market fundamentals,Journal of Urban Economics,https://www.sciencedirect.com/science/article/abs/pii/S0094119003000375,price_fundamentals,Long-run prices in the Bay Area are explained by rent and construction cost despite large short-run deviations.
131,Capozza D; Hendershott P; Mack C; Mayer C,2002,Determinants of real house price dynamics,NBER Working Paper 9262,https://www.nber.org/papers/w9262,price_fundamentals,Cross-metro short-run price dynamics exhibit strong momentum and mean-reversion at 3-5 year horizons.
132,Abraham J; Hendershott P,1996,Bubbles in metropolitan housing markets,Journal of Housing Research,https://www.jstor.org/stable/24832854,price_fundamentals,Identifies regional deviations from fundamentals and tests their predictability for future returns.
133,Goodman A; Thibodeau T,2008,Where are the speculative bubbles in US housing markets,Journal of Housing Economics,https://www.sciencedirect.com/science/article/abs/pii/S1051137708000041,price_fundamentals,Metro-specific bubble indicators flagged coastal California Florida and Las Vegas before 2007.
134,Gallin J,2006,The long-run relationship between house prices and income,Real Estate Economics,https://onlinelibrary.wiley.com/doi/10.1111/j.1540-6229.2006.00172.x,price_fundamentals,No cointegrating relationship between national prices and income in US post-war data.
135,Gallin J,2008,The long-run relationship between house prices and rents,Real Estate Economics,https://onlinelibrary.wiley.com/doi/10.1111/j.1540-6229.2008.00220.x,price_fundamentals,Price-rent ratio is stationary at national level but with 3-5 year deviations from mean.
136,Engsted T; Pedersen T,2015,Predicting returns and rent growth in the housing market,Journal of Empirical Finance,https://www.sciencedirect.com/science/article/abs/pii/S0927539815000341,price_fundamentals,Price-rent ratio strongly predicts future rent growth rather than returns contra Campbell-Shiller intuition.
137,Hjalmarsson E; Österholm P,2020,Heterogeneity in house-price dynamics,Regional Science and Urban Economics,https://www.sciencedirect.com/science/article/abs/pii/S0166046219303461,price_fundamentals,Large cross-metro heterogeneity in price-income and price-rent mean-reversion speeds.
138,Clayton J,1996,Rational expectations market fundamentals and housing price volatility,Real Estate Economics,https://onlinelibrary.wiley.com/doi/10.1111/1540-6229.00704,price_fundamentals,Rational-expectations model rejected on Vancouver data excess volatility in price-rent.
139,Cutler D; Poterba J; Summers L,1991,Speculative dynamics,Review of Economic Studies,https://academic.oup.com/restud/article/58/3/529/1565050,behavioural,Price momentum is a robust feature across asset classes including housing.
140,Barberis N; Greenwood R; Jin L; Shleifer A,2018,Extrapolation and bubbles,Journal of Financial Economics,https://www.sciencedirect.com/science/article/pii/S0304405X18301028,behavioural,Extrapolative expectations produce bubbles matching stylised facts of 2000s housing.
141,Greenwood R; Shleifer A,2014,Expectations of returns and expected returns,Review of Financial Studies,https://academic.oup.com/rfs/article/27/3/714/1571927,behavioural,Subjective expected returns co-move with past returns implying extrapolative beliefs dominate.
142,Anenberg E; Bayer P,2020,Endogenous sources of volatility in housing markets,Quantitative Economics,https://onlinelibrary.wiley.com/doi/10.3982/QE1113,inventory,Joint-moving-and-pricing decisions produce endogenous price-volume volatility amplification.
143,Guren A; McQuade T,2020,How do foreclosures exacerbate housing downturns,Review of Economic Studies,https://academic.oup.com/restud/article/87/3/1331/5570579,credit_supply,Foreclosures depress prices through a price-foreclosure feedback amplifying downturn by 25-45 percent.
144,Campbell J; Giglio S; Pathak P,2011,Forced sales and house prices,American Economic Review,https://www.aeaweb.org/articles?id=10.1257/aer.101.5.2108,credit_supply,Foreclosed-home sales transact at a 27 percent discount relative to comparable non-distressed sales.
145,Anenberg E,2016,Information frictions and housing market dynamics,International Economic Review,https://onlinelibrary.wiley.com/doi/10.1111/iere.12214,inventory,Information frictions generate sluggish price adjustment observable in listing-to-sale-price spreads.
146,Merlo A; Ortalo-Magné F,2004,Bargaining over residential real estate,Journal of Urban Economics,https://www.sciencedirect.com/science/article/abs/pii/S0094119004000051,inventory,UK listing-vs-sale-price data show bargaining dynamics that differ sharply across market states.
147,Carrillo P,2013,To sell or not to sell,Real Estate Economics,https://onlinelibrary.wiley.com/doi/10.1111/j.1540-6229.2012.00346.x,inventory,Price reductions on listings are a strong predictor of subsequent sale-price declines.
148,Carrillo P; Cellini S; Green R,2013,School quality and information transmission,Regional Science and Urban Economics,https://www.sciencedirect.com/science/article/abs/pii/S0166046212001275,inventory,Listing-text informational content shifts closing prices in noise-reduction experiments.
149,Anenberg E; Kung E,2014,Estimates of the size and source of price declines,American Economic Review,https://www.aeaweb.org/articles?id=10.1257/aer.104.8.2527,credit_supply,Foreclosures caused 3-5 percent price decline through a local-market-disamenity channel.
150,Gerardi K; Herkenhoff K; Ohanian L; Willen P,2018,Can't pay or won't pay,Review of Financial Studies,https://academic.oup.com/rfs/article/31/3/1098/4582661,credit_supply,Liquidity constraints more than negative equity drive mortgage default during 2008-09.
151,Ganong P; Noel P,2020,Liquidity vs wealth in household debt obligations,American Economic Review,https://www.aeaweb.org/articles?id=10.1257/aer.20181243,credit_supply,Liquidity shocks not equity shocks are the primary default trigger post-2007.
152,Kolko J,2021,Where Americans moved in 2020,Indeed Hiring Lab,https://www.hiringlab.org/2021/03/29/migration-patterns-in-2020/,cycle_2022,In-migration to lower-cost metros accelerated sharply in 2020.
153,Altig D; Baker S; Barrero J; Bloom N; Bunn P; Chen S; Davis S; Leather J; Meyer B; Mihaylov E; Mizen P; Parker N; Renault T; Smietanka P; Thwaites G,2020,Economic uncertainty before and during the COVID-19 pandemic,Journal of Public Economics,https://www.sciencedirect.com/science/article/pii/S0047272720301389,cycle_2022,Uncertainty spike during COVID of relevance to housing-market volatility channel.
154,Barrero J; Bloom N; Davis S,2021,Why working from home will stick,NBER Working Paper,https://www.nber.org/papers/w28731,cycle_2022,Remote work will persist at 20+ percent of work days with implications for metro housing demand.
155,Brueckner J; Kahn M; Lin G,2023,A new spatial hedonic equilibrium in the emerging work-from-home economy,American Economic Journal Applied Economics,https://www.aeaweb.org/articles?id=10.1257/app.20220287,cycle_2022,Work-from-home flattens bid-rent curve and is observable in spatial price gradients 2019-22.
156,Delventhal M; Parkhomenko A,2023,Spatial implications of telecommuting,Working Paper,https://alexparkhomenko.com/research/,cycle_2022,Full telecommuting equilibrium implies substantial redistribution across metros.
157,Davis M; Ghent A; Gregory J,2023,The work-from-home revolution,Working Paper,https://sites.google.com/view/morris-davis/research,cycle_2022,Work-from-home is equivalent to a productivity shock and affects long-run housing demand.
158,Bloom N; Han R; Liang J,2024,How hybrid working from home works out,NBER Working Paper,https://www.nber.org/papers/w30292,cycle_2022,Hybrid work reduces commute elasticity of housing demand.
159,Monte F; Porcher C; Rossi-Hansberg E,2023,Remote work and city structure,NBER Working Paper,https://www.nber.org/papers/w31494,cycle_2022,Remote work changes metro commuting zones in ways relevant to sub-metro price dynamics.
160,Garner T; Short K; Ziliak J,2022,Consumer price indices during COVID,BLS Working Paper,https://www.bls.gov/osmr/research-papers/2022/,cycle_2022,Shelter-cost measurement issues during COVID relevant to real price comparisons.
161,Adelino M; Schoar A; Severino F,2020,Dynamics of housing debt in the recent boom and great recession,NBER Macroeconomics Annual,https://www.nber.org/chapters/c14179,credit_supply,Debt distribution revisited finds middle-income borrowers mattered most not just subprime.
162,Griffin J; Kruger S; Maturana G,2021,What drove the 2003-2006 house price boom,Journal of Financial Economics,https://www.sciencedirect.com/science/article/pii/S0304405X20303056,credit_supply,Non-agency mortgage fraud and securitisation together drove approximately 60 percent of 2003-06 price appreciation.
163,Piskorski T; Seru A; Witkin J,2015,Asset quality misrepresentation by financial intermediaries,Journal of Finance,https://onlinelibrary.wiley.com/doi/10.1111/jofi.12271,credit_supply,Banks systematically misrepresented asset quality in RMBS relevant for crisis attribution.
164,Hartman-Glaser B,2017,Reputation and signaling in asset sales,Journal of Financial Economics,https://www.sciencedirect.com/science/article/pii/S0304405X16302240,credit_supply,Reputational incentives shift mortgage-pool composition over time.
165,Hurst E; Keys B; Seru A; Vavra J,2016,Regional redistribution through the US mortgage market,American Economic Review,https://www.aeaweb.org/articles?id=10.1257/aer.20151000,credit_supply,Government-sponsored enterprise pricing redistributes from low-risk to high-risk metros relevant for regional price dynamics.
166,Adelino M; Ma S; Robinson D,2017,Firm age investment opportunities and job creation,Journal of Finance,https://onlinelibrary.wiley.com/doi/10.1111/jofi.12495,credit_supply,Collateral-channel housing-price effects on small-business job creation.
167,Mian A; Sufi A,2011,What explains the 2007-2009 drop in employment,Econometrica,https://onlinelibrary.wiley.com/doi/10.3982/ECTA9042,macro,Cross-county housing-shock variation explains a large share of the 2007-09 employment decline.
168,Stroebel J,2016,Asymmetric information about collateral values,Journal of Finance,https://onlinelibrary.wiley.com/doi/10.1111/jofi.12343,credit_supply,Information asymmetries between lenders and borrowers observable in mortgage-rate differentials.
169,Agarwal S; Ben-David I; Yao V,2017,Systematic mistakes in home valuations,Journal of Financial Economics,https://www.sciencedirect.com/science/article/pii/S0304405X16302185,behavioural,Home appraisers systematically over-value during booms and under-value during busts.
170,Eriksen M; Fout H; Palim M; Rosenblatt E,2019,Contract price confirmation bias,Journal of Real Estate Finance and Economics,https://link.springer.com/article/10.1007/s11146-018-9682-z,behavioural,Appraisers bias toward confirming contract prices biasing LTV measurement and default risk estimates.
171,Kindleberger C; Aliber R,2011,Manias Panics and Crashes (6th ed),Palgrave Macmillan,https://link.springer.com/book/10.1007/978-0-230-36535-3,textbook_bubble,Classic narrative history of bubbles with chapters on US housing through 2008.
172,Galbraith J K,1994,A Short History of Financial Euphoria,Penguin,https://www.penguinrandomhouse.com/books/168515/a-short-history-of-financial-euphoria-by-john-kenneth-galbraith/,textbook_bubble,Describes recurrent features of speculative manias including extrapolation and leverage.
173,Akerlof G; Shiller R,2009,Animal Spirits,Princeton University Press,https://press.princeton.edu/books/paperback/9780691145921/animal-spirits,textbook_behavioural,Textbook treatment of behavioural foundations of macro instability including housing.
174,Thaler R,2015,Misbehaving,WW Norton,https://wwnorton.com/books/misbehaving/,textbook_behavioural,Behavioural-finance textbook with chapters relevant to real-estate decision-making anomalies.
175,Tetlock P,2017,Superforecasting,Broadway Books,https://www.penguinrandomhouse.com/books/227815/superforecasting-by-philip-e-tetlock-and-dan-gardner/,textbook_forecasting,Principles of probabilistic forecasting relevant for calibrated crash-probability claims.
176,Hastie T; Tibshirani R; Friedman J,2009,The Elements of Statistical Learning (2nd ed),Springer,https://hastie.su.domains/ElemStatLearn/,textbook_ml,Canonical statistical-learning textbook for the ML methods used in crash prediction.
177,Murphy K,2022,Probabilistic Machine Learning Advanced Topics,MIT Press,https://probml.github.io/pml-book/book2.html,textbook_ml,Covers probabilistic forecasting and calibration methods required for our pipeline.
178,Hyndman R; Athanasopoulos G,2021,Forecasting Principles and Practice (3rd ed),OTexts,https://otexts.com/fpp3/,textbook_forecasting,Time-series forecasting textbook with the rolling-origin CV methodology we use.
179,Kuhn M; Johnson K,2019,Feature Engineering and Selection,CRC Press,https://bookdown.org/max/FES/,textbook_ml,Reference for feature engineering and leakage control which is critical for this project.
180,Efron B; Hastie T,2016,Computer Age Statistical Inference,Cambridge University Press,https://hastie.su.domains/CASI/,textbook_ml,Covers bootstrap and resampling relevant for small-number-of-crises inference.
181,Gneiting T; Raftery A,2007,Strictly proper scoring rules prediction and estimation,Journal of the American Statistical Association,https://amstat.tandfonline.com/doi/abs/10.1198/016214506000001437,methodology_ml,Proper scoring rules essential for evaluating probabilistic crash forecasts.
182,Brier G,1950,Verification of forecasts expressed in terms of probability,Monthly Weather Review,https://journals.ametsoc.org/view/journals/mwre/78/1/1520-0493_1950_078_0001_vofeit_2_0_co_2.xml,methodology_ml,Original Brier score subsequently used for probabilistic-forecast evaluation.
183,Platt J,1999,Probabilistic outputs for support vector machines,Advances in Large Margin Classifiers MIT Press,https://home.cs.colorado.edu/~mozer/Teaching/syllabi/6622/papers/Platt1999.pdf,methodology_ml,Platt scaling for post-hoc calibration of classifier outputs.
184,Niculescu-Mizil A; Caruana R,2005,Predicting good probabilities with supervised learning,ICML,https://dl.acm.org/doi/10.1145/1102351.1102430,methodology_ml,Documents how tree ensembles are miscalibrated and how to fix them.
185,Chen T; Guestrin C,2016,XGBoost a scalable tree boosting system,KDD,https://dl.acm.org/doi/10.1145/2939672.2939785,methodology_ml,Gradient boosting framework heavily used in applied time-series classification.
186,Ke G; Meng Q; Finley T; Wang T; Chen W; Ma W; Ye Q; Liu T,2017,LightGBM a highly efficient gradient boosting decision tree,NeurIPS,https://papers.nips.cc/paper/6907-lightgbm-a-highly-efficient-gradient-boosting-decision-tree,methodology_ml,Gradient-boosting library with categorical handling relevant for metro-fixed-effect features.
187,Lundberg S; Lee S,2017,A unified approach to interpreting model predictions,NeurIPS,https://papers.nips.cc/paper/7062-a-unified-approach-to-interpreting-model-predictions,methodology_ml,SHAP values for per-prediction feature-importance attribution.
188,Bergmeir C; Benítez J,2012,On the use of cross-validation for time series,Information Sciences,https://www.sciencedirect.com/science/article/pii/S0020025511006773,methodology_ml,Blocked and rolling-origin CV is mandatory for time-series classification.
189,Cerqueira V; Torgo L; Mozetič I,2020,Evaluating time series forecasting models,Machine Learning,https://link.springer.com/article/10.1007/s10994-020-05880-w,methodology_ml,Empirical comparison of time-series CV schemes favours blocked designs.
