id,authors,year,title,journal,theme,notes
178,"European Construction Sector Observatory",2024,Country Fact Sheet Netherlands 2024,EC DG GROW,2,Dutch construction sector overview
179,"European Construction Sector Observatory",2024,Country Fact Sheet Denmark 2024,EC DG GROW,2,Danish construction sector overview
180,"European Construction Sector Observatory",2024,Country Fact Sheet Sweden 2024,EC DG GROW,2,Swedish construction sector overview
181,"European Construction Sector Observatory",2024,Country Fact Sheet Finland 2024,EC DG GROW,2,Finnish construction sector overview
182,"European Construction Sector Observatory",2024,Country Fact Sheet France 2024,EC DG GROW,2,French construction sector overview
183,"European Construction Sector Observatory",2024,Country Fact Sheet Austria 2024,EC DG GROW,2,Austrian construction sector overview
184,"European Construction Sector Observatory",2024,Country Fact Sheet Belgium 2024,EC DG GROW,2,Belgian construction sector overview
185,"European Construction Sector Observatory",2024,Country Fact Sheet Spain 2024,EC DG GROW,2,Spanish construction sector overview
186,"Dainty, A.R.J. et al.",2007,"Human Resource Management in Construction",Spon Press,3,HR management in construction industry
187,"Loosemore, M. et al.",2003,"Human Resource Management in Construction Projects",Spon Press,3,Construction HR and labour
188,"Abdel-Wahab, M. et al.",2008,"An exploration of the relationship between training grants and profitability of UK construction companies",International Journal of Training and Development,3,Training and construction productivity
189,"Chan, P.; Dainty, A.",2007,"Resolving the UK construction skills crisis: a critical perspective on the research and policy agenda",Construction Management and Economics,3,UK construction skills crisis analysis
190,"Agapiou, A. et al.",1995,"The role of labour in the construction industry: a review",Construction Management and Economics,3,Labour role in construction
191,"Arditi, D.; Mochtar, K.",2000,"Trends in productivity improvement in the US construction industry",Construction Management and Economics,3,US construction productivity trends
192,"Crawford, P.; Vogl, B.",2006,"Measuring productivity in the construction industry",Building Research and Information,3,Productivity measurement methodology
193,"Allmon, E. et al.",2000,"U.S. Construction Labor Productivity Trends 1970-1998",Journal of Construction Engineering and Management,3,Long-run US productivity trends
194,"Teicholz, P.",2013,"Labor Productivity Declines in the Construction Industry: Causes and Remedies (Another Look)",AECbytes,3,Construction productivity decline analysis
195,"MDPI",2022,"Analysis of Construction Cost and Investment Planning Using Time Series Data",Sustainability,7,Time series construction cost analysis
196,"ResearchGate",2005,"Time Series Analysis of ENR Construction Cost Index",ResearchGate,7,ENR index time series analysis
197,"ScienceDirect",2019,"Estimation and prediction of construction cost index using neural networks time series and regression",Alexandria Engineering Journal,7,Forecasting construction cost indices
198,"Springer",2017,"Forecasting Construction Cost Index Using Interrupted Time-Series",KSCE Journal of Civil Engineering,7,Interrupted time series for construction costs
199,"Springer",2021,"Time Series Analysis Framework for Forecasting Construction Labor Costs",KSCE Journal of Civil Engineering,7,Labour cost time series forecasting
200,"MDPI",2024,"Forecasting Construction Cost Indices: Methods Trends and Influential Factors",Buildings,7,Review of CCI forecasting methods
201,"Tandfonline",2023,"A systematic literature review on price forecasting models in construction industry",International Journal of Construction Management,7,Price forecasting SLR
202,"Bu.edu/Casini",2019,"Structural Breaks in Time Series",in Oxford Research Encyclopedia,7,Comprehensive review of structural break methods
203,"Newey, W.K.; West, K.D.",1987,"A Simple Positive Semi-definite Heteroskedasticity and Autocorrelation Consistent Covariance Matrix",Econometrica,7,HAC standard errors
204,"White, H.",1980,"A Heteroskedasticity-Consistent Covariance Matrix Estimator and a Direct Test for Heteroskedasticity",Econometrica,7,Robust standard errors
205,"Breusch, T.S.; Pagan, A.R.",1979,"A Simple Test for Heteroscedasticity and Random Coefficient Variation",Econometrica,7,BP test for heteroscedasticity
206,"Dickey, D.A.; Fuller, W.A.",1979,"Distribution of the Estimators for Autoregressive Time Series with a Unit Root",JASA,7,ADF unit root test
207,"Phillips, P.C.B.; Perron, P.",1988,"Testing for a Unit Root in Time Series Regression",Biometrika,7,PP unit root test
208,"Kwiatkowski, D. et al.",1992,"Testing the null hypothesis of stationarity against the alternative of a unit root",Journal of Econometrics,7,KPSS stationarity test
209,"Engle, R.F.; Granger, C.W.J.",1987,"Co-Integration and Error Correction: Representation Estimation and Testing",Econometrica,7,Cointegration methodology
210,"Johansen, S.",1991,"Estimation and Hypothesis Testing of Cointegration Vectors in Gaussian Vector Autoregressive Models",Econometrica,7,Johansen cointegration test
211,"Box, G.E.P.; Jenkins, G.M.",1970,Time Series Analysis: Forecasting and Control,Holden-Day,7,ARIMA methodology textbook
212,"Hastie, T. et al.",2009,The Elements of Statistical Learning (2nd ed.),Springer,7,Statistical learning reference
213,"James, G. et al.",2013,An Introduction to Statistical Learning,Springer,7,Introductory statistical learning
