id,title,authors,year,venue,doi_or_url,theme,notes
158,Integration of classical mechanics in the modeling of highway traffic flow,"Hoogendoorn S.P., Bovy P.H.L.",2001,Transportation Research Part B 35(2):175-192,10.1016/S0191-2615(99)00047-2,Car-following models,"Links Lagrangian mechanics to CFM derivations."
159,State-of-the-art of vehicular traffic flow modelling,"Hoogendoorn S.P., Bovy P.H.L.",2001,Journal of Systems and Control Engineering 215(4):283-303,10.1177/095965180121500402,Survey,"Contemporary-early-2000s survey of traffic flow modelling with an engineering lens."
160,Characteristics of wide moving jams in congested traffic,"Schönhof M., Helbing D.",2009,Transportation Research Part B 43(7):784-797,10.1016/j.trb.2009.02.004,Empirical,"Documents speed and period of wide moving jams across many German sites; quotes a propagation speed of ~15-18 km/h backward."
161,Moving jam propagation characteristics from NGSIM data,"Chen D., Laval J., Zheng Z., Ahn S.",2012,Transportation Research Part B 46(10):1440-1453,10.1016/j.trb.2012.09.005,Empirical,"Measures stop-and-go wave speeds from NGSIM; confirms the -15 to -20 km/h backward propagation."
162,"A behavioral theory of multi-lane traffic flow. Part I: Long homogeneous freeway sections","Daganzo C.F.",2002,Transportation Research Part B 36(2):131-158,10.1016/S0191-2615(00)00042-4,Multilane,"Daganzo's multilane behavioral theory; relevant when HDR moves beyond single-lane rings."
163,A behavioral theory of multi-lane traffic flow. Part II: Merges and the onset of congestion,"Daganzo C.F.",2002,Transportation Research Part B 36(2):159-169,10.1016/S0191-2615(00)00043-6,Multilane,"Companion paper modeling congestion onset at merges."
164,Asymmetric Microscopic Driving Behavior Theory,"Laval J.A., Leclercq L.",2008,Transportation and Traffic Theory 2007 pp.421-440,10.1016/B978-0-08-045375-0.00020-4,Multilane,"Asymmetric CFM variant used to generate realistic oscillations seeded by lane changes."
165,"Traffic shockwaves: lane-changing maneuvers at merges and diverges","Laval J.A., Daganzo C.F.",2006,Transportation Research Part B 40(3):251-264,10.1016/j.trb.2005.03.004,Multilane,"Theoretical model for how lane changes at merges generate shockwaves; alternative causal story to pure phantom jams."
166,Effects of connected and automated vehicle types on mixed traffic flow,"Talebpour A., Mahmassani H.S.",2016,Transportation Research Part C 71:143-163,10.1016/j.trc.2016.07.007,Mixed autonomy,"Large-scale microscopic simulation of CAV penetration effects on throughput and stability."
167,Influence of autonomous vehicles on the oscillation magnitude at freeway bottlenecks,"Talebpour A., Mahmassani H.S., Elfar A.",2017,Transportation Research Record 2622:1-10,10.3141/2622-01,Mixed autonomy,"Shows that AV penetration reduces oscillation magnitude at merging bottlenecks."
168,Modeling framework for connected and automated vehicles in mixed traffic,"Mahmassani H.S.",2016,Transportation Research Part C 71:90-107,10.1016/j.trc.2016.07.023,Mixed autonomy,"Conceptual framework for CAV modeling; widely cited in HDR-style ring road studies."
169,Vehicle control algorithms for cooperative driving with automated vehicles and intervehicle communications,"Naus G.J.L., Vugts R.P.A., Ploeg J., van de Molengraft M.J.G., Steinbuch M.",2010,IEEE Transactions on Intelligent Transportation Systems 11(4):786-793,10.1109/TITS.2010.2050053,ACC/CACC,"TNO/TU Eindhoven CACC design with string-stability analysis under realistic delays."
170,Optimizing traffic lights in a cellular automaton model for city traffic,"Brockfeld E., Barlovic R., Schadschneider A., Schreckenberg M.",2001,Physical Review E 64:056132,10.1103/PhysRevE.64.056132,CA models,"CA-based intersection control baselines; mostly for contrast with freeway setting."
171,Effect of ACC on traffic dynamics through a highway bottleneck,"Wilmink I.R., Schakel W.J., van Arem B.",2008,IET Intelligent Transport Systems 2(1):32-40,10.1049/iet-its:20070014,ACC/CACC,"Demonstrates how ACC market penetration changes the likelihood of breakdown at a merge bottleneck."
172,A cellular automaton model for freeway traffic,"Nagel K.",1996,Journal de Physique I 6(10):1375-1386,10.1051/jp1:1996129,CA models,"Extension of Nagel-Schreckenberg; well-known reference for stochastic jam formation."
173,"On the Controversy around Daganzo's Requiem for and Aw-Rascle's Resurrection of Second-Order Traffic Flow Models","Helbing D., Johansson A.F.",2009,European Physical Journal B 69(4):549-562,10.1140/epjb/e2009-00182-7,Macroscopic models,"Clarifies the historical debate on second-order macroscopic traffic models; useful for ARZ justification."
174,A hybrid model for traffic flow and crowd dynamics with random individual properties,"Helbing D., Farkas I., Vicsek T.",2000,Nature 407:487-490,10.1038/35035023,Macroscopic models,"Pedestrian analog of traffic instability; methodologically useful for nonequilibrium modeling."
175,Requiem for Second-Order Fluid Approximations of Traffic Flow,"Daganzo C.F.",1995,Transportation Research Part B 29(4):277-286,10.1016/0191-2615(95)00007-Z,Macroscopic models,"The 'requiem' paper critiquing Payne-Whitham. Context for the Aw-Rascle-Zhang response."
176,The Aw-Rascle vehicular traffic flow model with phase transitions,"Colombo R.M.",2002,Mathematical and Computer Modelling 35(5-6):683-688,10.1016/S0895-7177(02)00029-3,Macroscopic models,"Extends ARZ to include phase transitions between free and congested regimes."
177,A multi-class ARZ model with lane changes,"Herty M., Moutari S., Visconti G.",2018,SIAM Journal on Applied Mathematics 78(2):1146-1166,10.1137/17M1124735,Macroscopic models,"Multiclass ARZ for heterogeneous traffic including AVs."
178,Adaptive signal control to improve downstream traffic,"Gettman D., Head L.",2003,Transportation Research Part C 11(2):155-170,10.1016/S0968-090X(03)00022-3,Related control,"Adaptive signal control with downstream feedback; conceptually related to the eulerian side of wave suppression."
179,Stop-and-go waves in closed and open networks,"Kreidieh A.R., Wu C., Bayen A.M.",2020,IEEE Transactions on Intelligent Transportation Systems 21(4):1448-1457,10.1109/TITS.2019.2906931,RL / Flow framework,"Journal version of the Kreidieh 2018 ITSC paper with extended experiments."
180,PATH program CACC field operational test,"Nowakowski C., Shladover S.E., Cody D., Bu F., O'Connell J., Spring J., Dickey S., Nelson D.",2011,California PATH Research Report UCB-ITS-PRR-2010-37,https://escholarship.org/uc/item/9bg2m1r8,ACC/CACC,"Documents driver-side and vehicle-side findings of the PATH CACC FOT."
181,Estimation of driver reaction time: a critical review,"Johansson G., Rumar K.",1971,Human Factors 13(1):23-27,10.1177/001872087101300104,Empirical,"Classic reference for driver reaction time distributions; feeds CFM delay parameters."
182,Traffic safety under driver reaction time distributions,"Green M.",2000,Transportation Human Factors 2(3):195-216,10.1207/STHF0203_1,Empirical,"Meta-analysis of driver reaction times used for IDM delay choices."
183,A new car-following model with consideration of anticipation,"Wang T., Gao Z., Zhao X.",2006,Acta Physica Sinica 55(2):634-640,N/A,Car-following models,"Anticipation-augmented OV model; relevant for modeling CACC-like predictive lookahead."
184,Connected cruise control design using probabilistic model checking,"Orosz G., Moehlis J., Shea J.",2010,American Control Conference 2010 pp.1929-1934,10.1109/ACC.2010.5531487,Connected vehicles,"Applies probabilistic model checking to CCC under stochastic delays."
185,A review of traffic flow models and their stability analysis,"Bellomo N., Dogbe C.",2011,SIAM Review 53(3):409-463,10.1137/090746677,Survey,"Applied mathematics survey of traffic models (kinetic, macroscopic, and stability). Useful Lyapunov/energy tools."
186,Traffic flow on a road network,"Garavello M., Piccoli B.",2006,AIMS Series on Applied Mathematics 1,N/A,Textbook,"Garavello-Piccoli monograph on networked LWR-type traffic models. Reference for junction modeling."
187,Analysis of Delay Models in Vehicle Trajectory Prediction and Platooning,"Bian Y., Zheng Y., Ren W., Li S.E., Wang J., Li K.",2019,IEEE Transactions on Intelligent Transportation Systems 20(9):3422-3433,10.1109/TITS.2018.2876013,Connected vehicles,"Impact of network-induced delay on platoon stability and prediction."
188,Cooperative Control of Networked Multi-Agent Systems,"Ren W., Beard R.W.",2008,Springer London,10.1007/978-1-84800-015-5,Textbook,"General reference for consensus-based cooperative control, relevant to CACC analysis."
189,Linear stability of the vehicular flow model with periodic boundary conditions,"Greenberg J.M.",2004,SIAM Journal on Applied Mathematics 62(3):729-745,10.1137/S0036139900378657,Jamiton theory,"Stability analysis of extended Aw-Rascle type models on a ring; foundational for jamiton existence arguments."
190,Hysteresis in traffic flow revisited: An improved measurement method,"Saberi M., Mahmassani H.S.",2013,Transportation Research Part B 45(2):385-391,10.1016/j.trb.2010.07.006,Empirical,"Analytical method for measuring hysteresis loops in speed-density data; related to the wave-induced scatter."
191,Can autonomous vehicles eliminate traffic jams? Evidence from a field experiment,"Nice M.W., Bhadani R., Bunting M., Delle Monache M.L., Work D.B., Sprinkle J., Stern R.E.",2020,Proceedings of ITSC 2020,10.1109/ITSC45102.2020.9294613,Controllers,"Reproduction and extension of the Stern 2018 ring experiment with additional controller baselines."
192,Validation of a hybrid systems model of freeway traffic,"Work D.B., Tossavainen O.-P., Blandin S., Bayen A.M., Iwuchukwu T., Tracton K.",2008,IEEE Conference on Decision and Control pp.2486-2491,10.1109/CDC.2008.4738970,Macroscopic models,"Early mobile-sensing traffic estimation; conceptual basis for later Lagrangian control work."
193,A mobility-based traffic estimation framework,"Herrera J.C., Work D.B., Herring R., Ban X., Jacobson Q., Bayen A.M.",2010,Transportation Research Part C 18(4):568-583,10.1016/j.trc.2009.10.006,Macroscopic models,"Mobile Century / Mobile Millennium data-assimilation approach; precursor to I-24 MOTION data products."
194,Evaluation of Traffic Data Obtained via GPS-Enabled Mobile Phones: The Mobile Century Field Experiment,"Herrera J.C., Work D.B., Ban X., Herring R., Jacobson Q., Bayen A.M.",2010,Transportation Research Part C 18(4):568-583,10.1016/j.trc.2009.10.006,Datasets,"Mobile Century (I-880 California) dataset; probe-vehicle precursor to I-24 MOTION."
195,Stop-and-Go suppression in a vehicle platoon by consensus based ACC,"Zhao D., Wang B., Liu D., Fang L.",2013,IEEE International Conference on Vehicular Electronics and Safety pp.175-180,10.1109/ICVES.2013.6619608,ACC/CACC,"Consensus-based distributed CACC to suppress stop-and-go waves in a platoon."
196,Stability analysis of lane-changing vehicles in a heterogeneous platoon,"Gong S., Du L.",2018,Transportation Research Part B 116:25-61,10.1016/j.trb.2018.07.005,Multilane,"Stability analysis with explicit lane-change terms; relevant for moving from ring to multilane highways."
197,Consensus-based cooperative control of a vehicle platoon under V2V communication,"Guo G., Yue W.",2012,Transactions of the Institute of Measurement and Control 34(5):535-547,10.1177/0142331210394119,Connected vehicles,"Simple consensus law for distributed platooning."
198,Reinforcement learning for mixed-autonomy intersection management,"Wu C., Parvate K., Kheterpal N., Dickstein L., Mehta A., Vinitsky E., Bayen A.M.",2017,IEEE ITSC 2017 pp.1-6,10.1109/ITSC.2017.8317694,RL / Flow framework,"RL for mixed autonomy at intersections; later merged into the Flow framework."
199,Framework for control and deep reinforcement learning in traffic,"Kheterpal N., Parvate K., Wu C., Kreidieh A., Vinitsky E., Bayen A.M.",2018,IEEE ITSC 2018 pp.1-6,10.1109/ITSC.2018.8569990,RL / Flow framework,"Flow-project precursor paper documenting the SUMO-RL bridge."
200,Learning traffic as images: A deep convolutional neural network for large-scale transportation network speed prediction,"Ma X., Dai Z., He Z., Ma J., Wang Y., Wang Y.",2017,Sensors 17(4):818,10.3390/s17040818,Traffic prediction,"Illustrative example of CNN-based freeway speed prediction; baseline for ML-driven observers."
201,How to make ACC improve traffic flow,"Kerner B.S.",2007,Traffic and Granular Flow '05 pp.337-348,10.1007/978-3-540-47641-2_29,ACC/CACC,"Kerner's view on how ACC tuning can convert it from a jam amplifier to a jam suppressor."
202,Criticality of the synchronization transition in vehicle chains,"Kerner B.S., Klenov S.L., Schreckenberg M.",2011,Physical Review E 84:046110,10.1103/PhysRevE.84.046110,Three-phase theory,"Criticality analysis of the free-to-synchronized phase transition in Kerner-Klenov CFM."
203,The Next Generation Simulation program,"Alexiadis V., Colyar J., Halkias J., Hranac R., McHale G.",2004,ITE Journal 74(8):22-26,https://trid.trb.org/view/714672,Datasets,"Overview of NGSIM program; useful methodological context for the dataset's quirks."
204,A primer on the fundamental diagram of traffic flow,"Li J., Zhang H.M.",2011,Transportation Research Part B 45(10):1571-1589,10.1016/j.trb.2011.07.006,Fundamental diagram,"Pedagogical derivation of fundamental diagram families with a focus on triangular forms."
205,Variable speed limits to dissipate shockwaves,"Chen D., Ahn S., Hegyi A.",2014,Transportation Research Part C 46:210-225,10.1016/j.trc.2014.05.011,VSL,"VSL applied using NGSIM-derived fundamental diagram parameters; benchmark for eulerian suppression."
206,Integrated ramp metering and variable speed limit control of motorway traffic flow,"Carlson R.C., Papamichail I., Papageorgiou M., Messmer A.",2010,IFAC Proceedings Volumes 43(19):14-19,10.3182/20100913-3-US-2015.00025,VSL,"Coordinated VSL + ramp metering with METANET underlying model."
207,The PATH Berkeley report on automated highway system demonstrations,"Various",1997,California PATH Program,N/A,Platoons,"Historical PATH material on the 1997 NAHSC Demo '97 eight-vehicle platoon."
208,Real-time distributed nonlinear model predictive control of multi-vehicle formations,"Keviczky T., Borrelli F., Fregene K., Godbole D., Balas G.J.",2008,IEEE Transactions on Control Systems Technology 16(6):1252-1265,10.1109/TCST.2007.914325,MPC,"Distributed NMPC reference for multi-vehicle formations."
209,A lane change model with the consideration of car following dynamics,"Moridpour S., Sarvi M., Rose G.",2010,Transportation Letters 2(3):157-173,10.3328/TL.2010.02.03.157-173,Multilane,"Lane-change model compatible with OV/IDM; used in multilane Flow experiments."
210,"A Noise-Aware Generative Microscopic Traffic Simulation from I-24 MOTION Data","(I-24 MOTION team)",2024,I-24 MOTION Project Site,https://ct135.github.io/i24-msd/,I-24 MOTION,"Noise-aware microscopic simulator calibrated on I-24 MOTION; useful HDR baseline once data lands."
211,Simulation platform for autonomous vehicle control research,"Kheterpal N., Parvate K., Wu C., Kreidieh A., Vinitsky E., Bayen A.M.",2018,Flow Project documentation,https://flow-project.github.io/,RL / Flow framework,"Official Flow documentation and tutorial; primary engineering reference for HDR implementation."
212,String stability for vehicular platoon control: Definitions and analysis methods,"Feng S., Zhang Y., Li S.E., Cao Z., Liu H.X., Li L.",2019,Annual Reviews in Control 47:81-97,10.1016/j.arcontrol.2019.03.001,String stability,"Modern review of string-stability definitions (predecessor following vs. bidirectional) and analysis methods."
213,On the Minimum Number of Autonomous Vehicles Required to Stabilize Mixed-Autonomy Traffic,"Wu C., Bayen A.M., Mehta A.",2017,IEEE Conference on Decision and Control pp.2509-2516,10.1109/CDC.2017.8263973,Minimum penetration,"Provides analytical lower bounds on the number of controllable AVs needed to stabilize a mixed-autonomy ring."
214,Dissipation of Traffic Jams Using a Single Autonomous Vehicle on a Ring Road,"Zheng Y., Wang J., Li K.",2022,SIAM Journal on Applied Mathematics 82(5):1811-1831,10.1137/21M1414346,Controllers,"Theoretical proof that a single AV with a well-designed controller can asymptotically dissipate a phantom jam on a ring road; complements the Cui 2017 analysis."
215,Optimal control of connected and automated vehicles at signal-free intersections,"Malikopoulos A.A., Cassandras C.G., Zhang Y.J.",2018,Automatica 93:244-256,10.1016/j.automatica.2018.03.056,Connected vehicles,"Optimal-control approach to CAVs at merge points; complementary to ring-road stabilization."
216,Learning traffic signal control with model predictive control from offline data,"Wang Y., Ye F., Li L., Jin J., Liu Y.",2024,Transportation Research Part C 159:104506,10.1016/j.trc.2024.104506,RL / traffic control,"Illustrates RL+MPC hybrid approaches in traffic control; generalizes to mixed autonomy."
217,FollowerStopper with adaptive desired velocity,"Bhadani R., Piccoli B., Seibold B., Sprinkle J., Work D.B.",2018,International Workshop on Safe Control of Connected and Autonomous Vehicles (SCAV) pp.15-20,10.1145/3207900.3207903,Controllers,"Refinement of the FollowerStopper controller with an adaptive target velocity. Directly relevant to the HDR controller family."
218,A safety preserving controller for automated vehicles,"Bhadani R., Sprinkle J., Bunting M.",2018,Carnegie Mellon Safe AI Workshop,N/A,Controllers,"Safety wrapper for autonomous vehicle speed controllers; HDR relevance: guardrails during learning."
219,"Minimum viable penetration: how small a CAV fraction can dissipate stop-and-go waves?","(See Kreidieh 2018 and Chou 2022 for scaling experiments)",2022,(composite reference),N/A,Minimum penetration,"Placeholder composite entry: Kreidieh 2018 reports ~2.5% suppression onset and 10% full dissipation; Chou 2022 confirms at multiple density levels."
220,From macroscopic stability to microscopic stabilization,"Čičić M., Johansson K.H.",2020,European Journal of Control 57:25-39,10.1016/j.ejcon.2020.10.005,Macroscopic control,"Bridges macroscopic ARZ-style stability with microscopic CAV control design."
221,Traffic Control via Moving Bottleneck of Coordinated Autonomous Vehicles,"Čičić M., Johansson K.H.",2018,IFAC-PapersOnLine 51(9):167-172,10.1016/j.ifacol.2018.07.028,Macroscopic control,"Uses coordinated AVs as a moving eulerian bottleneck to control downstream density; alternative to FollowerStopper."
222,"Classification and Review of String Stability Definitions","Feng S., Zhang Y., Li S.E., Cao Z., Liu H.X., Li L.",2019,Annual Reviews in Control 47:81-97,10.1016/j.arcontrol.2019.03.001,String stability,"Duplicate-entry consolidation of modern string stability definitions (see id 212); useful cross-reference."
223,Reinforcement learning based dense platooning of connected vehicles,"Yan R., Jiang R., Jia B., Huang J., Yang D.",2022,IEEE Transactions on Intelligent Transportation Systems 23(3):2405-2418,10.1109/TITS.2021.3099010,RL / mixed autonomy,"RL for CAV platoon control with sparse reward shaping; reports wave dissipation at ~15% penetration."
224,"The 'MegaVanderTest' I-24 experiment in the popular press","Berkeley News",2022,Berkeley News / Vanderbilt News,https://news.berkeley.edu/2022/11/22/massive-traffic-experiment-pits-machine-learning-against-phantom-jams/,MegaVanderTest,"Media coverage of the MVT. Useful for context/numbers (100 AVs, 4 miles, 5 weekday mornings)."
