id,title,authors,year,venue,doi_or_url,theme,notes
74,Continuous control with deep reinforcement learning,"Lillicrap T.P., Hunt J.J., Pritzel A., Heess N., Erez T., Tassa Y., Silver D., Wierstra D.",2016,ICLR 2016,https://arxiv.org/abs/1509.02971,RL algorithms,"DDPG. Original actor-critic for continuous control; sometimes used as a baseline for AV speed control."
75,Human-level control through deep reinforcement learning,"Mnih V. et al.",2015,Nature 518:529-533,10.1038/nature14236,RL algorithms,"DQN. Foundational deep-RL reference used when classifying actions rather than velocities."
76,A multiscale model for traffic regulation via autonomous vehicles,"Garavello M., Goatin P., Liard T., Piccoli B.",2020,Journal of Differential Equations 269(7):6088-6124,10.1016/j.jde.2020.04.031,Macroscopic control,"Coupled PDE-ODE framework where AVs act as moving flux constraints in LWR. Basis for proving wave damping at the macroscopic level."
77,Scalar conservation laws with moving constraints arising in traffic flow modeling: an existence result,"Delle Monache M.L., Goatin P.",2014,Journal of Differential Equations 257(11):4015-4029,10.1016/j.jde.2014.07.014,Macroscopic control,"First existence proof for LWR with a moving bottleneck constraint from an AV. Mathematical foundation of macroscopic AV control."
78,A PDE-ODE model for traffic control with autonomous vehicles,"Delle Monache M.L., Liard T., Piccoli B., Stern R.E., Work D.B.",2019,Networks and Heterogeneous Media 14(3):495-518,10.3934/nhm.2019019,Macroscopic control,"Extends the PDE-ODE framework to multiple AVs and gives numerical schemes. Direct bridge between the Stern field experiments and the continuum picture."
79,Multiscale control of generic second order traffic models by driver-assist vehicles,"Chiarello F.A., Piccoli B., Tosin A.",2021,Multiscale Modeling & Simulation 19(2):589-611,10.1137/20M1360128,Macroscopic control,"Uses second-order macroscopic models with an AV density term to quantify the minimum AV fraction needed to stabilize a given equilibrium."
80,Nonlinear Optimal Control of Traffic Flow with Stability Guarantees,"Hayat A., Piccoli B., Truong S.",2023,IFAC-PapersOnLine 56(2):8482-8489,10.1016/j.ifacol.2023.10.026,Macroscopic control,"Derives a Lyapunov-based AV controller with provable closed-loop stability guarantees for the ARZ model."
81,How many autonomous vehicles are required to stabilize traffic flow?,"Bahavarnia M., Taha A.F.",2024,arXiv:2408.11212,https://arxiv.org/abs/2408.11212,Minimum penetration,"Optimizes the number of AVs needed to stabilize a given human flow subject to control saturation. Frames the minimum-penetration question as a constrained optimization."
82,Taming Spontaneous Stop-and-Go Traffic Waves: A Computational Mechanism Design Perspective,"(anonymized author set; see arXiv record)",2025,arXiv:2509.09441,https://arxiv.org/abs/2509.09441,Recent,"Mechanism-design framing of the wave-suppression problem. Treats CAV control policy as the product of a throughput/oscillation tradeoff game; searches for the optimal policy as a function of density."
83,A Review of Stop-and-Go Traffic Wave Suppression Strategies: Variable Speed Limit vs. Jam-Absorption Driving,"He Z., Laval J., Han Y., Hegyi A., Nishi R., Wu C.",2025,arXiv:2504.11372,https://arxiv.org/abs/2504.11372,Recent,"Direct 2025 review of the two dominant suppression paradigms. Useful for contextualizing the HDR question: which of VSL-style eulerian or JAD-style lagrangian wins and under what penetration."
84,Stabilizing traffic flow by autonomous vehicles: Stability analysis and implementation considerations,"Yao Z., Wu Y., Wang Y., Zhao B., Jiang Y.",2024,Transportation Research Part C 159:104494,10.1016/j.trc.2024.104494,Controllers,"Recent CFM-based stabilization analysis with practical notes on sampling rate, delay, and acceleration saturation."
85,Data-Driven Traffic Reconstruction and Kernel Methods for Identifying Stop-and-Go Congestion,"Zhao E., Wang H., Hayat A., Delle Monache M.L., Work D.B., Bayen A.M.",2023,arXiv:2312.03186,https://arxiv.org/abs/2312.03186,I-24 MOTION,"Kernel-based stop-and-go wave identification from I-24 MOTION trajectories; provides a ground-truth labeling pipeline for HDR evaluation."
86,Modeling Monitoring and Controlling Road Traffic Using Vehicles to Sense and Act,"Delle Monache M.L., Sprinkle J., Vasudevan R., Work D.B.",2023,Annual Review of Control Robotics and Autonomous Systems 6:149-174,10.1146/annurev-control-062122-100953,Survey,"Recent CIRCLES-authored survey of mobile-actuator traffic control including sensing trade-offs and the field-test methodology."
87,Achieving string stability of ACC vehicles via feedback on acceleration and jerk,"Santhanakrishnan K., Rajamani R.",2003,American Control Conference 2003 pp.3271-3276,10.1109/ACC.2003.1244041,ACC/CACC,"Jerk-feedback controller design that provably achieves string stability for ACC platoons."
88,String stability of automated vehicle platoons operating in the absence of V2V communications,"Al Alam A., Gattami A., Johansson K.H.",2010,IEEE ITSC 2010 pp.306-311,10.1109/ITSC.2010.5625050,ACC/CACC,"Early study showing that without V2V feedback, time-gap policies must exceed ~1.4 s for ACC to achieve string stability."
89,Optimal Control Theoretic View on Cooperative Adaptive Cruise Control,"Wang M., Daamen W., Hoogendoorn S.P., van Arem B.",2014,Transportation Research Part C 47:285-300,10.1016/j.trc.2014.09.001,ACC/CACC,"MPC-based CACC that treats the CACC problem as a distributed optimal control problem."
90,Rolling horizon control framework for driver assistance systems. Part II: Cooperative sensing and cooperative control,"Wang M., Daamen W., Hoogendoorn S.P., van Arem B.",2014,Transportation Research Part C 40:290-311,10.1016/j.trc.2013.11.024,ACC/CACC,"Companion paper to [89] with implementation-level MPC details."
91,Model Predictive Control for Distributed Systems,"Camponogara E., Jia D., Krogh B.H., Talukdar S.",2002,IEEE Control Systems Magazine 22(1):44-52,10.1109/37.980246,MPC,"General reference for distributed MPC; relevant to platoon-level control formulations."
92,Receding horizon network control,"Jia D., Krogh B.H.",2001,American Control Conference 2001 pp.4884-4889,10.1109/ACC.2001.945765,MPC,"Early networked MPC reference used as theoretical background for distributed CACC MPCs."
93,Model predictive control system design and implementation for vehicle platooning,"Dunbar W.B., Caveney D.S.",2012,IEEE Transactions on Intelligent Transportation Systems 13(3):1145-1158,10.1109/TITS.2011.2179045,MPC,"Distributed MPC for platoon control with formal stability certificates."
94,Longitudinal vehicle controller design for IVHS systems,"Hedrick J.K., McMahon D.H., Narendran V.K., Swaroop D.",1991,American Control Conference 1991 pp.3107-3112,10.23919/ACC.1991.4791589,Platoons,"Classical PATH-era platoon longitudinal control reference."
95,Automatic Highway Systems - A Final Report,"Shladover S.E.",1995,California PATH Research Report UCB-ITS-PRR-95-11,https://escholarship.org/uc/item/9tn4k3kr,Platoons,"PATH program summary; historical AHS demonstrations precursor to modern mixed autonomy."
96,Automated Vehicle Control Developments in the PATH Program,"Varaiya P.",1993,IEEE Transactions on Vehicular Technology 42(2):114-130,10.1109/25.231881,Platoons,"Seminal IVHS / automated highway systems architecture paper. Establishes the platoon/string control paradigm."
97,Smart cars on smart roads: problems of control,"Varaiya P.",1993,IEEE Transactions on Automatic Control 38(2):195-207,10.1109/9.250509,Platoons,"Classical control-theoretic view of automated highway systems."
98,The Karlsruhe Lane Change Assistant: A first result of the KONVOI project,"Konvoi project group",2009,5th European Congress and Exhibition on Intelligent Transport Systems,N/A,ACC/CACC,"KONVOI CACC truck platoon field demonstration (Germany). Early real-world CACC field data."
99,Experimental investigation of cooperative adaptive cruise control on tracks,"Milanés V., Shladover S.E., Spring J., Nowakowski C., Kawazoe H., Nakamura M.",2014,IEEE Transactions on Intelligent Transportation Systems 15(1):296-305,10.1109/TITS.2013.2278494,ACC/CACC,"PATH/Nissan four-vehicle CACC field experiments on a closed track; string stability demonstrated experimentally with a 0.6-0.9 s time gap."
100,Cooperative Adaptive Cruise Control Implementation in the Grand Cooperative Driving Challenge,"Kianfar R., Augusto B., Ebadighajari A., Hakeem U., Nilsson J., Raza A., Tabar R.S., Irukulapati N.V., Englund C., Falcone P., Papanastasiou S., Svensson L., Wymeersch H.",2012,IEEE Transactions on Intelligent Transportation Systems 13(3):994-1007,10.1109/TITS.2012.2201177,ACC/CACC,"Details one of the GCDC-2011 winning CACC implementations."
101,Decentralized cooperative lane-changing decision-making for connected autonomous vehicles,"Wang M., Hoogendoorn S.P., Daamen W., van Arem B., Happee R.",2015,Transportation Research Part C 58:73-92,10.1016/j.trc.2015.07.009,Connected vehicles,"Cooperative lane-change MPC in mixed autonomy; matters for practical wave suppression when lane changes seed oscillations."
102,Simulation to scaled city: zero-shot policy transfer for traffic control via autonomous vehicles,"Jang K., Vinitsky E., Chalaki B., Remer B., Beaver L., Malikopoulos A.A., Bayen A.M.",2019,International Conference on Cyber-Physical Systems (ICCPS) pp.291-300,10.1145/3302509.3313784,Mixed autonomy,"Zero-shot RL-to-real transfer on the University of Delaware scaled city. Closes part of the sim-to-real gap for traffic RL."
103,Quantifying air quality benefits resulting from few autonomous vehicles stabilizing traffic,"Stern R.E., Chen Y., Churchill M., Wu F., Delle Monache M.L., Piccoli B., Seibold B., Sprinkle J., Work D.B.",2019,Transportation Research Part D 67:351-365,10.1016/j.trd.2018.12.008,Energy & emissions,"Air-quality gains from the Stern 2018 ring field test: NOx -4% to -10%, fuel -40%."
104,An overview of vehicular platoon control under the four-component framework,"Zheng Y., Li S.E., Li K., Borrelli F., Hedrick J.K.",2016,Vehicle System Dynamics 54(3):356-394,10.1080/00423114.2015.1137894,Platoons,"Review article classifying platoon controllers by node dynamics, information flow topology, formation geometry, and control law."
105,Stability and Scalability of Homogeneous Vehicular Platoon: Study on the Influence of Information Flow Topologies,"Zheng Y., Li S.E., Wang J., Cao D., Li K.",2016,IEEE Transactions on Intelligent Transportation Systems 17(1):14-26,10.1109/TITS.2015.2402153,Platoons,"Proves how predecessor-only, predecessor-leader, and bidirectional topologies affect scalability and string stability."
106,"Cooperative driving: an ant colony system for autonomous intersection management","Dresner K., Stone P.",2008,Journal of Artificial Intelligence Research 31:591-656,10.1613/jair.2502,Connected vehicles,"AI-style intersection management for CAVs. Relevant as downstream destination for wave-free freeway flow."
107,Traffic shockwave attenuation via variable speed limits,"Hegyi A., De Schutter B., Hellendoorn H.",2005,Transportation Research Part C 13(3):185-209,10.1016/j.trc.2004.08.001,VSL,"Model-predictive VSL controller that smooths shockwaves. Eulerian counterpart to Lagrangian AV control."
108,Dynamic traffic control using SPECIALIST: a Variable Speed Limit algorithm for shock-wave suppression,"Hegyi A., Hoogendoorn S.P., Schreuder M., Stoelhorst H., Viti F.",2008,IEEE ITSC 2008 pp.827-832,10.1109/ITSC.2008.4732632,VSL,"Field trial of the SPECIALIST VSL algorithm on a Dutch motorway; significant reduction in wide moving jams."
109,Model predictive control for variable speed limit systems,"Hegyi A., De Schutter B., Hellendoorn J.",2005,IEEE Transactions on Intelligent Transportation Systems 6(1):102-112,10.1109/TITS.2004.842408,VSL,"MPC formulation for VSL with an underlying METANET model."
110,Variable speed limits on I-4 in Orlando: experience,"Chang J., Lin P.-W., Paniati J.F.",2011,Transportation Research Record 2221:59-68,10.3141/2221-07,VSL,"Real-world VSL deployment data; useful reference for the eulerian baseline."
111,Coordinated ramp metering: A study case,"Papageorgiou M., Hadj-Salem H., Middelham F.",1997,IEEE Transactions on Intelligent Transportation Systems 3(1):7-13,10.1109/6979.828836,Ramp metering,"ALINEA ramp metering. Classical feedback policy for local bottleneck stabilization."
112,ALINEA: A Local Feedback Control Law for On-Ramp Metering,"Papageorgiou M., Hadj-Salem H., Blosseville J.-M.",1991,Transportation Research Record 1320:58-64,N/A,Ramp metering,"The original ALINEA paper; simple, effective, pedagogically useful baseline for any upstream-bottleneck HDR scenario."
113,ALINEA Local Ramp Metering: Summary of Field Results,"Papageorgiou M., Kotsialos A.",2002,Transportation Research Record 1603:90-98,10.3141/1603-12,Ramp metering,"Review of multi-site ALINEA deployments."
114,Learning a robust multi-agent driving policy for traffic congestion reduction,"Jang K., Vinitsky E., Kreidieh A., Bayen A.M.",2023,Neural Computing and Applications 35:27105-27123,10.1007/s00521-023-09183-8,RL / Flow framework,"Multi-agent decentralized RL policies for mixed autonomy; shows robust wave dissipation across demand regimes."
115,Optimizing Mixed Autonomy Traffic Flow with Decentralized Autonomous Vehicles and Multi-Agent Reinforcement Learning,"Yan L., Wu C.",2023,ACM Transactions on Cyber-Physical Systems 7(3) Art.16,10.1145/3582576,RL / Flow framework,"Large-scale decentralized MARL study of mixed-autonomy ring and bottleneck benchmarks; PPO with graph state."
116,Emergent Cooperative Driving Strategies for Stop-and-Go Wave Mitigation via Multi-Agent Reinforcement Learning,"(anonymized; see arXiv record)",2025,arXiv:2511.14378,https://arxiv.org/abs/2511.14378,Recent,"Recent MARL paper on emergent cooperative CAV policies specifically targeting stop-and-go wave mitigation."
117,Lagrangian traffic flow measurement,"Edie L.C., Foote R.S.",1958,Highway Research Board Proceedings 37:334-344,N/A,Empirical,"Early Edie work on trajectory-based traffic measurement; precursor to the 1963 generalized-definitions paper."
118,Car-Following Models: A Multidisciplinary Review,"Saifuzzaman M., Zheng Z.",2014,Transportation Research Part C 48:379-403,10.1016/j.trc.2014.09.008,Survey,"Organizes the CFM literature by underlying modeling philosophy (engineering, psychology, physics)."
119,A review of car-following models and modeling tools for human and autonomous-ready driving behaviors in micro-simulation,"He Z., Xu R., Xie D., Zong F., Zhong R., Zhu W.",2022,Transportation Research Part C 139:103672,10.1016/j.trc.2022.103672,Survey,"Recent survey emphasizing CFMs used for AV simulation and their calibration constraints."
120,Twenty-Five Years of the Intelligent Driver Model: Foundations Extensions Applications and Future Directions,"Treiber M., Kesting A.",2025,arXiv:2506.05909,https://arxiv.org/abs/2506.05909,Car-following models,"25-year retrospective by IDM's authors; catalogues IDM variants, calibration best practices, and open problems."
121,Calibrating car-following models using trajectory data: Methodological study,"Kesting A., Treiber M.",2008,Transportation Research Record 2088:148-156,10.3141/2088-16,Calibration,"Gold-standard calibration workflow for IDM: objective function, error metrics, cross-validation protocol."
122,A state-space linear stability analysis of platoons of cooperative vehicles,"Naus G.J.L., Vugts R.P.A., Ploeg J., van de Molengraft M.J.G., Steinbuch M.",2017,Transportmetrica B 7(1):1-19,10.1080/21680566.2017.1308846,String stability,"State-space tool for string-stability analysis of generic platoon controllers."
123,Design and experimental evaluation of cooperative adaptive cruise control,"Ploeg J., Scheepers B.T.M., van Nunen E., van de Wouw N., Nijmeijer H.",2011,IEEE ITSC 2011 pp.260-265,10.1109/ITSC.2011.6082981,ACC/CACC,"TU Eindhoven CACC testbed with detailed experimental results."
124,Lp String Stability of Cascaded Systems: Application to Vehicle Platooning,"Ploeg J., van de Wouw N., Nijmeijer H.",2014,IEEE Transactions on Control Systems Technology 22(2):786-793,10.1109/TCST.2013.2258346,String stability,"Clean definition and proof of Lp (L2 L∞) string stability for cascaded linear systems; standard reference."
125,Controller Synthesis for String Stability of Vehicle Platoons,"Ploeg J., Shukla D.P., van de Wouw N., Nijmeijer H.",2014,IEEE Transactions on Intelligent Transportation Systems 15(2):854-865,10.1109/TITS.2013.2291493,String stability,"H-infinity synthesis of CACC controllers with string-stability guarantees; practical implementation notes."
126,Closed-form expressions for optimal ACC settings to avoid traffic jams,"Sau J., Monteil J., Billot R., El Faouzi N.-E.",2014,IEEE Conference on Intelligent Transportation Systems pp.1499-1505,10.1109/ITSC.2014.6957923,ACC/CACC,"Analytically derives ACC gain regions that guarantee ring stability for OV and IDM human leaders."
127,From homogeneous to heterogeneous traffic flows: Lp String stability under uncertain model parameters,"Monteil J., Bhouri N., Billot R., El Faouzi N.-E.",2021,Transportation Research Part B 146:1-23,10.1016/j.trb.2021.01.001,String stability,"Extends Lp string stability to uncertain heterogeneous CFM parameters. Relevant to HDR robustness analysis."
128,Traffic Experiment Reveals the Nature of Car-Following,"Jiang R., Hu M.-B., Zhang H.M., Gao Z.-Y., Jia B., Wu Q.-S., Wang B., Yang M.",2014,PLOS ONE 9(4):e94351,10.1371/journal.pone.0094351,Ring-road experiments,"Chinese ring-road experiment with 25 cars; documents spontaneous wave formation and measures concavity of fundamental diagram."
129,Cellular automaton microscopic model of traffic flow,"Nagel K., Schreckenberg M.",1992,Journal de Physique I 2(12):2221-2229,10.1051/jp1:1992277,CA models,"The Nagel-Schreckenberg CA model; the minimal stochastic discrete model exhibiting spontaneous jams."
130,Metastable states in a microscopic model of traffic flow,"Krauss S., Wagner P., Gawron C.",1997,Physical Review E 55(5):5597-5602,10.1103/PhysRevE.55.5597,CA models,"Krauss model: collision-free discrete CFM. Default CFM in early versions of SUMO."
131,Microscopic simulation of congested traffic,"Krauss S.",1998,PhD Thesis University of Cologne,https://sumo.dlr.de/pdf/KraussDiss.pdf,CA models,"Full derivation of the Krauss model and its metastability properties."
132,Delay-feedback control strategy for reducing CO2 emission of traffic flow system,"Nagatani T., Nakanishi K.",1998,Physical Review E 57(6):6415-6421,10.1103/PhysRevE.57.6415,Controllers,"Delay-feedback stabilization of ring-road OV traffic; early theoretical precursor of FollowerStopper."
133,Analytical theory of traffic flow,"Mahnke R., Kaupuzs J., Lubashevsky I.",2005,Physics Reports 408(1-2):1-130,10.1016/j.physrep.2004.12.001,Survey,"Comprehensive theoretical physics review including nucleation-style arguments for jam formation."
134,Stability analysis of optimal velocity model for traffic and granular flow under open boundary condition,"Sugiyama Y., Nakayama A., Hasebe K.",2003,Physical Review E 68:067102,10.1103/PhysRevE.68.067102,Jamiton theory,"OV stability under open boundary conditions; complements the ring-road picture for realistic highways."
135,Physics of traffic jams,"Nagatani T.",2002,Reports on Progress in Physics 65(9):1331-1386,10.1088/0034-4885/65/9/203,Survey,"Nagatani's physics-style review of OV/CA models and their jam properties."
136,Analytical investigation of oscillations in intersecting car traffic,"Davis L.C.",2002,Physical Review E 66:046115,10.1103/PhysRevE.66.038101,Jamiton theory,"Uses delay-feedback analysis to estimate propagation speed of stop-and-go waves on a single lane."
137,Nonlinear effects of saturation in the car-following model,"Molnar T.G., Insperger T., Bachrathy D., Orosz G.",2018,Nonlinear Dynamics 91(2):1007-1019,10.1007/s11071-017-3899-x,String stability,"Quantifies how acceleration/deceleration saturation reshapes the region of string stability."
138,Dampen the stop-and-go traffic with connected and automated vehicles,"Li S., Wang J., Li K., Lian X.",2021,IEEE Transactions on Intelligent Transportation Systems 23(8):11879-11891,10.1109/TITS.2021.3107314,Controllers,"Mixed-autonomy CAV controller that jointly uses V2V info and IDM leaders; benchmarked on NGSIM-derived scenarios."
139,Deep Dense Multi-level Feature Connected Network for Real-Time Traffic Prediction,"Li Y., Yu R., Shahabi C., Liu Y.",2018,ICLR 2018,https://arxiv.org/abs/1707.01926,Traffic prediction,"DCRNN for traffic forecasting; only tangentially relevant but widely cited as a deep-learning baseline in this community."
140,The Intelligent Driver Model with Stochasticity - New Insights Into Traffic Flow Oscillations,"Treiber M., Kesting A.",2017,Transportation Research Procedia 23:174-187,10.1016/j.trpro.2017.05.011,Car-following models,"Shows that IDM + Gaussian acceleration noise reproduces NGSIM-level oscillation statistics; relevant for HDR noise model."
141,Wave selection problems in the presence of a bistable background,"Belletti F., Huo M., Litrico X., Bayen A.M.",2018,Journal of Statistical Physics 172(2):566-586,10.1007/s10955-018-2028-7,Jamiton theory,"Analyses wave selection in bistable CFM systems; provides context for why some jamitons dominate the attractor."
142,Prediction of traffic convective instability with spectral analysis,"Belletti F., Huo M., Litrico X., Bayen A.M.",2015,IEEE Conference on Decision and Control pp.1515-1520,10.1109/CDC.2015.7402424,Jamiton theory,"Spectral method for detecting incipient stop-and-go instability from detector data."
143,Empirical features of congested traffic states and their implications for traffic modeling,"Treiber M., Kesting A., Helbing D.",2006,Transportation Research Part B 40(5):365-399,10.1016/j.trb.2005.05.002,Empirical,"Classifies empirical congestion patterns from German loop data; basis for many later CFM validation studies."
144,Understanding widely scattered traffic flows the capacity drop and platoons as effects of variance-driven time gaps,"Treiber M., Kesting A., Helbing D.",2006,Physical Review E 74:016123,10.1103/PhysRevE.74.016123,Empirical,"Derives capacity drop from driver heterogeneity and time-gap variance."
145,Derivation equilibrium and stability of a macroscopic traffic flow model,"Treiber M., Hennecke A., Helbing D.",1999,Physical Review E 59(1):239-253,10.1103/PhysRevE.59.239,Macroscopic models,"Gas-kinetic-based macroscopic derivation with stability analysis."
146,Three-phase traffic theory and highway capacity,"Kerner B.S.",2004,Physica A 333:379-440,10.1016/j.physa.2003.10.017,Three-phase theory,"Dense exposition of three-phase theory in a journal-length format."
147,Experimental features of the emergence of moving jams in free traffic flow,"Kerner B.S., Rehborn H.",1996,Journal of Physics A 29(14):L397-L402,10.1088/0305-4470/29/14/008,Empirical,"Early empirical observation of wide moving jams emerging from free flow on German autobahns."
148,Empirical macroscopic features of spatial-temporal traffic patterns at highway bottlenecks,"Kerner B.S., Klenov S.L., Hiller A.",2002,Physical Review E 65:046138,10.1103/PhysRevE.65.046138,Empirical,"Characterizes bottleneck-induced synchronized flow patterns; benchmark for three-phase theory."
149,Deterministic approach to microscopic three-phase traffic theory,"Kerner B.S., Klenov S.L.",2006,Journal of Physics A 39(8):1775-1809,10.1088/0305-4470/39/8/002,Three-phase theory,"Microscopic Kerner-Klenov model implementing three-phase theory; alternative to IDM/OV for stop-and-go generation."
150,Anisotropy of synchronized flow,"Schoenhof M., Helbing D.",2007,Transportation Research Part B 43(7):784-797,10.1016/j.trb.2009.02.004,Empirical,"Documents the anisotropic spatial propagation of synchronized flow patterns."
151,Empirical test of a macroscopic fundamental diagram for urban traffic,"Geroliminis N., Daganzo C.F.",2008,Transportation Research Part B 42(9):759-770,10.1016/j.trb.2008.02.002,Macroscopic models,"Macroscopic Fundamental Diagram (MFD) for urban networks. Only tangentially relevant but often cited together."
152,The fundamental diagram: a historical review,"del Castillo J.M., Benitez F.G.",1995,Transportation Research Part B 29(6):373-389,10.1016/0191-2615(95)00008-2,Fundamental diagram,"Historical sweep through fundamental-diagram functional forms (Greenshields Greenberg Underwood Drake Pipes)."
153,"A kinematic-wave approach to traffic flow theory","May A.D., Keller H.E.M.",1967,Highway Research Record 199:19-32,N/A,Fundamental diagram,"Early bridging paper between kinematic-wave theory and empirical q-k data."
154,Calibration of IDM based on trajectory data,"Sharma A., Zheng Z., Bhaskar A.",2019,Transportation Research Part C 101:213-230,10.1016/j.trc.2019.02.013,Calibration,"Identifies IDM parameter ranges that fit NGSIM and German trajectory datasets."
155,Safety implications of higher-order car-following models,"Kesting A., Treiber M.",2008,Transportation Research Record 2088:51-60,10.3141/2088-06,Safety,"Investigates collision-risk implications of CFM choices, including time-to-collision distributions."
156,Field operational test results on the impact of adaptive cruise control on driver behavior,"Viti F., Hoogendoorn S.P., van Zuylen H.J., Wilmink I.R., van Arem B.",2008,Transportation Research Part C 16(4):469-487,10.1016/j.trc.2007.11.001,ACC/CACC,"Field study of driver interactions with ACC; documents distribution of selected time gaps."
157,Full Velocity Difference Model for a Car-Following Theory,"Jiang R., Wu Q., Zhu Z.",2001,Physical Review E 64:017101,10.1103/PhysRevE.64.017101,Car-following models,"FVDM: OV model augmented with relative-velocity feedback. Stabler than pure OV; used in many HDR variants."
