id,title,authors,year,type,domain,subcategory,method,key_finding,hypothesis_generated,relevance
1,Quantum Computation and Quantum Information (10th Anniv Ed.),"Nielsen, M.A.; Chuang, I.L.",2010,textbook,fundamentals,qec_basics,analytic,Canonical textbook Chapter 10 stabilizer formalism CSS 9-qubit Shor code,Reference for all stabilizer-code arguments,5
2,Quantum Error Correction (Cambridge),"Lidar, D.A.; Brun, T.A. (eds.)",2013,textbook,fundamentals,edited_review,analytic,Edited volume covering stabilizer topological subsystem and DFS codes,Canonical reference for operator QEC,5
3,Stabilizer Codes and Quantum Error Correction (PhD thesis),"Gottesman, D.",1997,textbook,fundamentals,stabilizer,analytic,Stabilizer formalism Clifford hierarchy fault-tolerance constructions,Core framework,5
4,Lecture Notes on Quantum Information,"Preskill, J.",2024,textbook,fundamentals,pedagogical,analytic,Preskill online QIT lecture notes; Chapter 7 QEC,Pedagogical reference,4
5,Computational Complexity: A Modern Approach,"Arora, S.; Barak, B.",2009,textbook,complexity,complexity_textbook,analytic,Canonical complexity textbook covering BQP P NP PSPACE,Complexity-class context for Shor,4
6,The Design and Analysis of Computer Algorithms,"Aho, A.V.; Hopcroft, J.E.; Ullman, J.D.",1974,textbook,algorithms,algorithms_textbook,analytic,Classical algorithms textbook covering matching graph algorithms,Data structures for MWPM,4
7,Introduction to Algorithms (CLRS),"Cormen, T.H.; Leiserson, C.E.; Rivest, R.L.; Stein, C.",2009,textbook,algorithms,algorithms_textbook,analytic,Modern algorithms textbook covering graph matching and union-find,Blossom and UF algorithm references,4
8,Low-density parity-check codes,"Gallager, R.G.",1963,textbook,classical_coding,ldpc_foundation,analytic,Foundational LDPC codes and sum-product decoding,Classical BP origin,5
9,Modern Coding Theory,"Richardson, T.; Urbanke, R.",2008,textbook,classical_coding,ldpc_textbook,analytic,Canonical textbook for iterative LDPC decoding,Reference for BP theory,4
10,Information Theory Inference and Learning Algorithms,"MacKay, D.J.C.",2003,textbook,classical_coding,info_theory,analytic,MacKay textbook covering BP + LDPC,Pedagogical BP reference,3
11,Elements of Information Theory,"Cover, T.; Thomas, J.",2006,textbook,classical_coding,info_theory,analytic,Canonical info-theory textbook,MAP/ML decoding intuition,3
12,Quantum Error Correction (review),"Terhal, B.M.",2015,review,fundamentals,memory_review,analytic,Comprehensive review of QEC for quantum memories,Organising scaffold,5
13,Topological quantum memory,"Dennis, E.; Kitaev, A.; Landahl, A.; Preskill, J.",2002,paper,fundamentals,topological,analytic,First analysis of surface-code thresholds via random-bond Ising model,Foundational for surface code,5
14,Fault-tolerant quantum computation by anyons,"Kitaev, A.",2003,paper,fundamentals,topological,analytic,Toric surface code and topological protection,Foundational,5
15,Surface codes: Towards practical large-scale quantum computation,"Fowler, A.G.; Mariantoni, M.; Martinis, J.M.; Cleland, A.N.",2012,review,surface_code,review,analytic,Canonical surface-code architecture review threshold ~1% MWPM circuit noise,Baseline surface-code architecture,5
16,Fault-tolerant quantum computation with constant error rate,"Aharonov, D.; Ben-Or, M.",1997,paper,fundamentals,threshold,analytic,Threshold theorem via concatenated codes,Foundational,5
17,Resilient quantum computation,"Knill, E.; Laflamme, R.; Zurek, W.",1998,paper,fundamentals,threshold,analytic,Independent threshold theorem proof,Foundational,4
18,Quantum error correction for beginners,"Devitt, S.J.; Munro, W.J.; Nemoto, K.",2013,review,fundamentals,pedagogical,analytic,Pedagogical QEC review,Teaching entry point,3
19,Quantum Error Correction review,"Brun, T.A.",2019,review,fundamentals,pedagogical,analytic,Pedagogical QEC review arXiv:1910.03672,Teaching-level entry,4
20,Good Quantum Codes with Low-Weight Stabilizers,"Panteleev, P.; Kalachev, G.",2022,paper,qldpc,asymptotic,construction,First asymptotically good qLDPC codes arXiv:2111.03654,Ends 25-year open problem,5
21,Quantum Tanner codes,"Leverrier, A.; Zemor, G.",2022,paper,qldpc,asymptotic,construction,Simplified good qLDPC via left-right Cayley complex,Simpler proof,4
22,Decoding quantum Tanner codes,"Leverrier, A.; Zemor, G.",2022,paper,qldpc,decoder,analytic,Linear-time decoder for q-Tanner codes,Decoder for asymptotically good codes,4
23,High-threshold and low-overhead fault-tolerant quantum memory (BB code),"Bravyi, S.; Cross, A.; Gambetta, J.; Maslov, D.; Rall, P.; Yoder, T.",2024,paper,qldpc,bivariate_bicycle,simulation,IBM [[144,12,12]] bivariate bicycle code ~0.8% threshold Nature,Anchor paper for low-overhead qLDPC,5
24,Quantum LDPC codes with almost linear time decoders,"Leverrier, A.; Londe, V.; Zemor, G.",2022,paper,qldpc,decoder,analytic,Small-set-flip decoder for quantum expander codes,qLDPC decoder landscape,3
25,Degenerate Quantum LDPC Codes With Good Finite Length Performance (BP+OSD),"Panteleev, P.; Kalachev, G.",2019,paper,qldpc,decoder,simulation,Introduces BP+OSD for qLDPC several-orders-of-magnitude improvement arXiv:1904.02703,BP+OSD is gold standard for qLDPC,5
26,Decoding across the quantum LDPC code landscape,"Roffe, J.; White, D.R.; Burton, S.; Campbell, E.T.",2020,paper,qldpc,decoder,simulation,Extensive BP+OSD benchmarking across qLDPC families,BP+OSD generalises empirically,4
27,Stim: a fast stabilizer circuit simulator,"Gidney, C.",2021,software,simulator,stabilizer,numerical,SIMD-vectorised stabilizer simulator arXiv:2103.02202,Baseline simulator for QEC,5
28,PyMatching v2: library for decoding QEC with MWPM,"Higgott, O.; Gidney, C.",2023,software,decoder,mwpm,numerical,Sparse-blossom CPU MWPM ~1M err/core-s arXiv:2303.15933,Baseline MWPM decoder,5
29,Sinter: Monte Carlo sampler for QEC circuits,"Gidney, C.",2023,software,decoder_sampler,driver,numerical,Driver for Stim + PyMatching Monte Carlo benchmarking,Standard workflow driver,4
30,CUDA-Q QEC: NVIDIA open-source QEC library,"NVIDIA",2024,software,simulator,gpu_qec,numerical,GPU BP+OSD with 29-35x single-shot speedup,Primary GPU BP+OSD tool,5
31,CUDA-Q QEC 0.6 enables real-time QEC with NVQLink,"NVIDIA",2026,blog,software,gpu_qec,release_notes,0.6 release RelayBP 19x further speedup Ising predecoder + PyMatching hybrid pipeline 2us/cycle on B300,Current GPU QEC state of the art,5
32,Surface code break-even (Google Quantum AI),"Google Quantum AI",2023,paper,experiment,surface_code,experiment,First break-even demonstration Nature 614 676,First break-even milestone,5
33,Quantum error correction below the surface code threshold (Willow),"Google Quantum AI",2024,paper,experiment,surface_code,experiment,Distance-7 surface on 105-qubit Willow suppression factor ~2 per two distances,Benchmark below-threshold device,5
34,Learning high-accuracy error decoding (AlphaQubit),"Bausch, J.; Senior, A.W.; Heras, F.J.H.; et al.",2024,paper,ml_decoder,transformer,learning,Transformer+recurrent decoder 6% fewer errors than TN,Neural decoder SOTA,5
35,Logical quantum processor based on reconfigurable atom arrays,"Bluvstein, D.; et al. (Harvard/QuEra/MIT)",2024,paper,experiment,neutral_atom,experiment,48 logical qubits with multiple codes on 448 atoms,Anchor for neutral-atom QEC,5
36,Dynamically Generated Logical Qubits (honeycomb Floquet),"Hastings, M.B.; Haah, J.",2021,paper,floquet,construction,analytic,Honeycomb code subsystem with dynamic logicals,Opens Floquet family,5
37,Surface code quantum computing by lattice surgery,"Horsman, D.; Fowler, A.G.; Devitt, S.; Van Meter, R.",2012,paper,lattice_surgery,universal,analytic,Lattice surgery merge/split surface patches,Basis for surface-code compilers,5
38,A Game of Surface Codes (Litinski PBC),"Litinski, D.",2019,paper,lattice_surgery,compilation,analytic,Pauli-based computation Quantum 3 128,Primary resource-estimation framework,5
39,Magic State Distillation: Not as Costly as You Think,"Litinski, D.",2019,paper,magic_state,distillation,simulation,~10x magic-state overhead reduction via block distillation,Canonical distillation protocol,4
40,Magic state cultivation,"Gidney, C.; Shutty, N.; Jones, C.",2024,preprint,magic_state,cultivation,simulation,Magic-state infidelity 2e-9 at ~1 T-equivalent qubit-round arXiv:2409.17595,Changes FTQC overhead accounting,5
41,Universal quantum computation with ideal Clifford gates and noisy ancillas,"Bravyi, S.; Kitaev, A.",2005,paper,magic_state,distillation,analytic,Canonical magic-state distillation,Foundational for T cost,5
42,High-threshold universal quantum computation on the surface code,"Fowler, A.G.; Stephens, A.M.; Groszkowski, P.",2009,paper,surface_code,universal,analytic,Fully explicit surface-code architecture ~1.1% threshold,Historical anchor,4
43,Using Azure Quantum Resource Estimator,"Beverland, M.E.; et al.",2023,software,resource_estimation,azure,estimate,Public Azure resource estimator,Primary tool for overhead comparison,5
44,Assessing requirements to scale to practical quantum advantage,"Beverland, M.E.; Murali, P.; Troyer, M.; et al.",2022,preprint,resource_estimation,fault_tolerance,estimate,Microsoft RE framework arXiv:2211.07629,Detailed overhead accounting method,5
45,How to factor 2048 bit RSA integers in 8 hours using 20 million noisy qubits,"Gidney, C.; Ekerå, M.",2021,paper,resource_estimation,shor,estimate,Classic surface-code RSA estimate 20M qubits p=1e-3 Quantum 5 433,Historical anchor for RSA estimates,5
46,How to factor 2048 bit RSA integers with less than a million noisy qubits,"Gidney, C.",2025,preprint,resource_estimation,shor,estimate,Updated RSA estimate <1M qubits arXiv:2505.15917,Pre-registered algorithm for our project,5
47,Low-overhead fault-tolerant quantum computing using long-range connectivity,"Xu, Q.; Ataides, J.P.B.; Pattison, C.A.; Raveendran, N.; Bluvstein, D.; Wurtz, J.; Vasić, B.; Lukin, M.D.; Cong, I.",2024,paper,qldpc,connectivity,estimate,End-to-end qLDPC architecture on reconfigurable atom arrays arXiv:2308.08648,qLDPC-to-hardware bridge,5
48,Architecture for fast implementation of qLDPC codes with optimized Rydberg gates,"Viszlai, B.; et al.",2024,preprint,qldpc,neutral_atom,architecture,qLDPC via Rydberg gates arXiv:2404.18809,Neutral-atom qLDPC,3
49,GPU-Accelerated Belief Propagation for qLDPC codes,"Kim, S.; et al.",2025,preprint,decoder,gpu,algorithm,<63us decoding qLDPC GPU improved BP,Real-time decoder-speed milestone,4
50,Improved BP is sufficient for real-time decoding of quantum memory,"Authors (Google/Riverlane)",2025,preprint,decoder,bp,algorithm,BP alone with improvements enough for streaming arXiv:2506.01779,Challenges BP+OSD consensus,4
51,Machine learning message-passing for scalable decoding of qLDPC codes,"Authors",2025,paper,decoder,ml,learning,GNN-based message passing npj QI 2025,Mid-complexity ML decoder,3
52,Pipelined correlated MWPM of the surface code,"Higgott, O.; Bohdanowicz, T.C.; Kubica, A.; et al.",2023,paper,decoder,mwpm,algorithm,Correlated matching with FPGA pipelining Quantum 7 1205,Streaming MWPM,4
53,Riverlane Local Clustering Decoder hardware paper,"Riverlane authors",2025,paper,decoder,fpga,hardware,FPGA LCD <1us per round leakage-adaptive Nat Commun,SOTA hardware decoder,5
54,Demonstrating real-time and low-latency QEC with superconducting qubits,"Authors",2024,preprint,experiment,superconducting,experiment,arXiv:2410.05202 real-time stream demo,Real-time demonstration,4
55,Sparse blossom: correcting a million errors per core second,"Higgott, O.; Gidney, C.",2023,paper,decoder,mwpm,algorithm,PyMatching v2 internals 1M err/core-second arXiv:2303.15933,PyMatching v2 engine,4
56,Almost-linear time decoding algorithm for topological codes (Union Find),"Delfosse, N.; Nickerson, N.H.",2021,paper,decoder,union_find,algorithm,UF decoder near-linear time Quantum 5 595,Fast MWPM alternative,5
57,Union-find decoders for homological product codes,"Delfosse, N.; Hastings, M.B.",2021,paper,decoder,qldpc,algorithm,UF for homological-product codes,UF beyond 2D,3
58,FPGA-based distributed union-find decoder,"Authors",2024,preprint,decoder,fpga,hardware,Distributed UF on FPGA arXiv:2406.08491,Streaming UF,3
59,Fusion Blossom: Fast MWPM Decoders for QEC,"Wu, Y.; Zhong, L.",2023,preprint,decoder,mwpm,algorithm,Parallel fusion blossom arXiv:2305.08307,Parallel MWPM alternative,4
60,Micro-blossom: hardware-accelerated MWPM for QEC,"Wu, Y.",2025,preprint,decoder,fpga,hardware,Xilinx Zynq SoC MWPM decoder,Hardware MWPM baseline,3
61,Almost-optimal MWPM decoding algorithm,"Fowler, A.G.",2013,paper,decoder,mwpm,algorithm,O(N) serial O(1) parallel MWPM (unreleased) arXiv:1307.1740,Fowler sparse MWPM origin,4
62,Fowler correlated matching,"Fowler, A.G.",2013,paper,decoder,correlated,algorithm,Correlated matching for surface code,Correlated MWPM baseline,4
63,PyMatching: A Python package for decoding with MWPM (v1),"Higgott, O.",2022,software,decoder,mwpm,tool,PyMatching v1 ACM TQC,Standard MWPM package,5
64,Real-Time Decoding for Fault-Tolerant Quantum Computing,"Terhal, B.M.; et al.",2023,review,decoder,realtime_review,review,Real-time decoding review arXiv:2303.00054,Real-time decoder review,5
65,A real-time scalable fast highly resource-efficient decoder for quantum computer,"Riverlane authors",2023,preprint,decoder,realtime,hardware,Riverlane real-time decoder flagship arXiv:2309.05558,Riverlane flagship,4
66,MWPM for fault-tolerant surface code in real time,"Skoric, L.; Browne, D.E.; Barnes, K.M.; Gillespie, N.I.; Campbell, E.T.",2022,preprint,decoder,mwpm,algorithm,Streaming MWPM with window decoding arXiv:2211.14216,Streaming MWPM,4
67,Predictive Window Decoding for Fault-Tolerant Quantum Programs,"Authors",2024,preprint,decoder,window,algorithm,Predictive window decoding arXiv:2412.05115,Window alignment,3
68,A Case for Elastic Quantum Error Correction Decoders,"Authors",2024,preprint,decoder,elastic,algorithm,Elastic decoder resources arXiv:2406.17995 10-40% reduction,Elastic scheduling,4
69,Impacts of Decoder Latency on Utility-Scale Quantum Computer Architectures,"Bhatnagar, et al.",2025,preprint,decoder,latency,analysis,Reaction-time impact on magic-state LER arXiv:2511.10633 aligned-window 50% improvement,Nearest-neighbour prior art on reaction time,5
70,Scalable Neural Decoders for Practical Fault-Tolerant Quantum Computation (Cascade),"Authors",2026,preprint,ml_decoder,nn_streaming,learning,Cascade NN for BB + surface codes 17x LER improvement arXiv:2604.08358,Cross-code NN decoder,4
71,Accelerating BP-OSD Decoder for QLDPC Codes with Local Syndrome-Based Preprocessing,"Authors",2025,preprint,decoder,bposd,algorithm,Local syndrome preprocessing for BP-OSD arXiv:2509.01892 HPCA 2026,BP+OSD latency reduction,3
72,Fully Parallelized BP Decoding for Quantum LDPC Codes Can Outperform BP-OSD,"Authors",2025,preprint,decoder,bp,algorithm,Parallel BP without OSD arXiv:2507.00254,BP-only streaming,3
73,Ambiguity Clustering: an accurate and efficient decoder for qLDPC codes,"Authors",2024,preprint,decoder,qldpc,algorithm,OSD alternative with ambiguity clustering arXiv:2406.14527,OSD alternative,3
74,Localized statistics decoding for quantum LDPC codes,"Authors",2024,preprint,decoder,lsd,algorithm,LSD algorithm arXiv:2406.18655 competitive with BP+OSD,Parallel OSD alternative,3
75,Decision-tree decoders for general quantum LDPC codes,"Authors",2025,preprint,decoder,decision_tree,algorithm,Small-memory DT decoder for qLDPC arXiv:2502.16408,Alternative decoder class,2
76,A joint code and belief propagation decoder design for qLDPC,"Authors",2024,preprint,qldpc,co_design,analytic,qLDPC codes co-designed with BP no short-4 cycles arXiv:2401.06874,Code+decoder co-design,4
77,Machine Learning Decoding of Circuit-Level Noise for Bivariate Bicycle Codes,"Authors",2025,preprint,ml_decoder,qldpc,learning,Neural decoder for BB codes arXiv:2504.13043,NN decoder for BB,3
78,Astra machine learning decoder for qLDPC,"Authors",2025,preprint,decoder,ml,learning,Astra NN decoder higher thresholds BB up to d=18,ML decoder BB,3
79,Mamba-based neural decoder for QEC,"Authors",2025,preprint,ml_decoder,mamba,learning,State-space model decoder,Architecture alternative,2
80,HyperNQ: A Hypergraph Neural Network Decoder for qLDPC,"Authors",2025,preprint,ml_decoder,gnn,learning,Hypergraph NN for qLDPC arXiv:2511.01741,GNN decoder,3
81,AlphaQubit 2 scalable real-time NN decoder,"Senior, A.W.; Edlich, T.; Higgott, O.; Bausch, J.; et al.",2025,preprint,ml_decoder,realtime,learning,Sub-1us/cycle on color + surface arXiv:2512.07737,Streaming NN decoder SOTA,5
82,Scalable Neural Decoders for Practical Real-Time QEC,"Authors",2025,preprint,ml_decoder,streaming,learning,Streaming NN via distillation 6us latency arXiv:2510.22724,Streaming NN target,4
83,Neural decoders for universal quantum algorithms,"Authors",2025,preprint,ml_decoder,universal,learning,NN decoder for logical algorithms arXiv:2509.11370,NN scope extension,3
84,Interpretability of neural network decoders,"Bödeker, N.; et al.",2025,paper,ml_decoder,interp,learning,Adv Quant Tech mechanistic interp of NN decoders,Interp research,2
85,Constant-overhead fault-tolerant quantum computation,"Gottesman, D.",2014,paper,resource_estimation,constant,analytic,Constant-overhead FTQC for good qLDPC,Theoretical benchmark,5
86,Overhead analysis of qLDPC vs surface code,"Cohen, L.; Kim, I.; Bartlett, S.; Brown, B.",2024,paper,resource_estimation,qldpc,analytic,Analytic qLDPC vs surface overhead comparison,Analytic prior art for our project,5
87,Computing Efficiently in QLDPC Codes,"Authors",2025,preprint,qldpc,computation,analytic,qLDPC computation primitives survey arXiv:2502.07150,qLDPC computation,4
88,Sequences of Bivariate Bicycle Codes from Covering Graphs,"Symons, B.C.B.; Rajput, A.; Browne, D.E.",2025,preprint,qldpc,bivariate_bicycle,construction,h-cover BB new [[64,14,8]] [[144,14,14]] arXiv:2511.13560,BB family expansion,4
89,Fair Decoder Baselines and Rigorous Finite-Size Scaling for BB Codes on Erasure Channel,"Pandey, T.",2026,preprint,decoder,qldpc,simulation,BB pseudo-thresholds 0.370-0.471 across N arXiv:2603.19062,BB on erasure,3
90,BiBiEQ: BB Codes on Erasure Qubits,"Bhave, A.S.; Choudhury, N.; Nemec, A.; Basu, K.",2026,preprint,qldpc,erasure,construction,BB + erasure conversion arXiv:2602.07578,BB erasure variant,3
91,Geometry-induced correlated noise in qLDPC syndrome extraction,"Authors",2026,preprint,qldpc,correlated,analysis,Routing geometry induces correlated faults arXiv:2604.01040,qLDPC noise caveat,3
92,In-Situ Simultaneous Magic State Injection on Arbitrary CSS qLDPC Codes,"Authors",2026,preprint,magic_state,qldpc,analytic,First in-situ magic-state injection for CSS qLDPC arXiv:2604.05126,In-situ qLDPC injection,4
93,Architectural mechanisms of a universal fault-tolerant quantum computer (NA),"Authors (Harvard/QuEra)",2025,preprint,architecture,universal,analytic,Full NA FTQC architecture arXiv:2506.20661,NA FTQC blueprint,4
94,Low-overhead qLDPC computing via lattice-surgery analogues,"Authors",2024,preprint,qldpc,gates,analytic,Addressable qLDPC logical ops,qLDPC logical ops,3
95,Automorphism gates in bivariate bicycle codes,"Authors",2025,preprint,qldpc,gates,analytic,Automorphism-based gates for BB codes,BB gate construction,3
96,Low-overhead magic state preparation using distilled BB codes,"Authors",2024,preprint,magic_state,qldpc,analytic,BB code as distillation factory,BB for distillation,3
97,Fault-tolerant gate sets for qLDPC codes,"Zhu, G.; Breuckmann, N.P.; et al.",2023,paper,qldpc,universality,analytic,Fault-tolerant Clifford gates via automorphisms,qLDPC universality,4
98,qLDPC + lattice surgery architecture,"Authors",2024,preprint,qldpc,architecture,analytic,qLDPC coupled to surface patches via lattice surgery,Hybrid architecture,3
99,The Q-Spellbook: Surface Code Layouts and Magic State Protocols,"Authors",2025,preprint,compilation,surface_code,engineering,Compiler-level layout optimisation arXiv:2502.11253,Compilation layout,3
100,Scheduling Lattice Surgery with Magic State Cultivation,"Authors",2025,preprint,compilation,lattice_surgery,engineering,Cultivation-pipeline scheduling arXiv:2512.06484,Scheduling + cultivation,3
101,Locality-aware Pauli-based computation for local magic state preparation,"Authors",2025,preprint,compilation,pauli_based,engineering,PBC + locality arXiv:2504.12091,Compilation engineering,2
102,Pauli-based computation (PBC foundational),"Bravyi, S.; Smith, G.; Smolin, J.A.",2016,paper,compilation,pauli_based,analytic,Canonical PBC reference,Basis for Litinski 2019,4
103,Magic State Cultivation on the Surface Code (High Rate),"Authors",2025,preprint,magic_state,cultivation,simulation,High-rate cultivation variants arXiv:2502.01743,Extends Gidney 2024,3
104,Unfolded distillation: low-cost magic state preparation for biased-noise qubits,"Authors",2026,paper,magic_state,biased_noise,simulation,Biased-noise distillation npj QI,Biased-noise magic states,3
105,How to factor RSA integers (v3),"Gidney, C.; Ekerå, M.",2021,paper,resource_estimation,shor,estimate,Quantum 5 433 surface code 20M qubits 8h,Historical RSA anchor,5
106,Efficient circuits for exact-universal computation with qudits,"Bullock, S.S.; O'Leary, D.P.; Brennen, G.K.",2005,paper,resource_estimation,qudits,analytic,Qudit circuit compilation,Qudit alternative,2
107,Windowed arithmetic for factoring,"Gidney, C.",2019,preprint,compilation,arithmetic,analytic,Windowed modular arithmetic reducing T-count,Arithmetic optimisation for Shor,4
108,Shor's algorithm original paper,"Shor, P.W.",1997,paper,algorithm,shor,analytic,SIAM J Comput 26 1484 Shor factoring,Shor canonical,5
109,Factoring in polynomial time on a quantum computer,"Shor, P.W.",1994,paper,algorithm,shor,analytic,FOCS 94 Shor polynomial-time factoring,Shor origin,5
110,Circuit for Shor factoring with 2n+3 qubits,"Beauregard, S.",2003,preprint,resource_estimation,shor,estimate,2n+3 logical qubits arXiv:quant-ph/0205095,Historical Shor layout,4
111,Quantum resource estimates for ECDLP,"Roetteler, M.; et al.",2017,paper,resource_estimation,ecc,estimate,ECC dlog resource estimate,Crypto beyond RSA,3
112,Quantum computing for chemistry: Lee et al.,"Lee, J.; et al.",2021,paper,resource_estimation,chemistry,estimate,Quantum chemistry resource estimates npj QI,Chemistry benchmark,3
113,Quantum computing enhanced computational catalysis,"von Burg, V.; et al.",2021,paper,resource_estimation,chemistry,estimate,Detailed catalysis RE PRResearch,Chemistry benchmark,3
114,Resource estimates for lattice QCD,"Shaw, A.F.; et al.",2020,preprint,resource_estimation,hep,estimate,Lattice QCD quantum simulation resources,HEP benchmark,2
115,Resource estimation for Hubbard model ground state,"Authors",2022,paper,resource_estimation,simulation,estimate,Hubbard ground-state RE ~10^7 qubits,Condensed-matter benchmark,3
116,NIST quantum-threat cryptography guidance,"NIST",2024,report,crypto,policy,policy,NIST PQ-crypto migration guidance,Policy context,3
117,Q-Day approaching quantum threat timeline,"TheQuantumInsider",2026,blog,crypto,policy,policy,Q-Day timeline tightening 2026,Policy context,2
118,The rotated surface code planar lattice,"Bombin, H.; Martin-Delgado, M.A.",2007,paper,surface_code,rotated,analytic,Rotated surface code,Rotated-code variant,3
119,Optimal circuit-level decoding for surface codes,"Tuckett, D.K.; Bartlett, S.D.; Flammia, S.T.",2016,paper,decoder,mwpm,simulation,Optimal thresholds arXiv:1609.06373,Decoder benchmarking reference,3
120,The XZZX surface code,"Bonilla Ataides, J.P.; Tuckett, D.K.; Bartlett, S.D.; Flammia, S.T.; Brown, B.J.",2021,paper,biased_noise,xzzx,simulation,>5% threshold biased noise Nature Comm,Biased-noise code,4
121,Tailored XZZX codes for biased noise,"Darmawan, A.S.; Brown, B.J.; Grimsmo, A.L.; Tuckett, D.K.; Puri, S.",2021,paper,biased_noise,xzzx,simulation,XZZX optimisation for biased noise,Biased-noise tailoring,3
122,Correcting coherent errors with surface codes,"Bravyi, S.; Englbrecht, M.; König, R.; Peard, N.",2018,paper,coherent_noise,surface_code,simulation,Surface code under coherent errors vs Pauli twirl,Coherent-noise sensitivity,4
123,Tensor-network simulations of surface code under realistic noise,"Darmawan, A.S.; Poulin, D.",2018,paper,coherent_noise,tensor_network,simulation,MPS sim of surface code beyond Pauli,Realistic simulation,3
124,Efficient Simulation of Leakage Errors Using Tensor Network Methods,"Authors",2023,preprint,leakage,tensor_network,simulation,MPS leakage sim arXiv:2308.08186,Leakage sim without Pauli twirl,3
125,Incoherent Approximation of Leakage in QEC,"Authors",2024,preprint,leakage,approximation,theory,Subspace Twirling Approximation arXiv:2312.10277,Leakage approximation,3
126,Surface code with leakage and erasure,"Suchara, M.; Cross, A.W.; Gambetta, J.M.",2015,paper,leakage,surface_code,simulation,Early leakage in surface code,Leakage baseline,3
127,Experimental QEC below threshold via all-microwave leakage suppression,"Authors",2025,paper,experiment,leakage,experiment,PRL leakage suppression,Experimental leakage handling,3
128,General tensor network decoding of 2D Pauli codes,"Chubb, C.T.",2021,paper,decoder,tensor_network,algorithm,Near-optimal TN decoder O(n log n + n chi^3) arXiv:2101.04125,Near-optimal decoder baseline,4
129,Enhancing fault-tolerant surface code decoding with iterative lattice reweighting,"Authors",2025,preprint,decoder,mwpm,algorithm,Lattice reweighting arXiv:2509.06756,Decoder enhancement,2
130,Performance enhancement of surface codes via recursive MWPM decoding,"Authors",2023,paper,decoder,mwpm,algorithm,Phys Rev A recursive MWPM,Decoder enhancement,3
131,Noise-aware decoder improvements,"Authors",2025,preprint,decoder,adaptive,algorithm,arXiv:2502.21044 noise-aware decoding,Adaptive decoder,3
