id	description	status	metric	value	prior	posterior	mechanism	notes	interaction
E00	Baseline: catalogue of 8 proposed warp/FTL metrics with energy condition status	KEEP	catalogue_completeness	8 metrics catalogued	-	-	Systematic extraction from 9 arXiv papers	Baseline catalogue: Alcubierre, Natario, Krasnikov, Morris-Thorne, Lentz, Bobrick-Martire, Fell-Heisenberg, Van Den Broeck	False
E01	Alcubierre exotic matter mass for v=c R=100m	KEEP	M_exotic	~1.5 M_sun	0.85	0.90	T^00 = -(v^2 rho^2)/(32pi r_s^2)(df/dr)^2; integrate over shell volume	Pfenning-Ford: M_exotic ~ v^2 R c^2 / G ~ 10^{30} kg ~ M_sun for R=100m v=c. Confirmed order of magnitude.	False
E02	Alcubierre exotic matter for v=0.1c (subluminal)	KEEP	M_exotic	~0.015 M_sun	0.90	0.92	T^00 scales as v_s^2; sign unchanged	M_exotic(0.1c) = M_exotic(c) * (0.1)^2 = 0.01 * 1.5 M_sun ~ 0.015 M_sun. Still requires exotic matter even subluminally.	False
E03	Van Den Broeck exotic matter reduction	KEEP	M_exotic_ratio	~100x reduction	0.75	0.80	Volume expansion reduces external bubble area while keeping internal volume	Van Den Broeck: R_ext ~ 10^{-15} m, M_exotic ~ M_sun (down from ~10^{62} kg). But Bobrick-Martire show this is coordinate-equivalent to Alcubierre with different parameters.	False
E04	Natario vs Alcubierre exotic matter comparison	KEEP	M_exotic_ratio	Same order of magnitude	0.60	0.70	Both in Natario class; Santiago NEC no-go applies to both	Natario (zero expansion) still violates NEC/WEC. Exotic matter requirement same order as Alcubierre for same v_s, R parameters.	False
E05	Lentz 2021: reproduce positive-energy claim	KEEP	WEC_status	Cannot reproduce: WEC violated	0.50	0.15	Lentz potential is not solution to his own PDE	Attempted to verify Lentz claim. The rhomboidal source function with specified parameters produces regions of negative Eulerian energy density. Consistent with Celmaster-Rubin refutation.	False
E06	Celmaster 2025: verify Lentz WEC violation	KEEP	WEC_status	Confirmed: WEC violated	0.90	0.95	Direct computation of Eulerian energy density from Lentz geometry shows negative regions	Celmaster identified: (1) Lentz potential not solution to his PDE, (2) multiple derivation errors in WEC-compliance argument, (3) even corrected geometry (MLRS) still violates WEC.	False
E07	Fell-Heisenberg 2024: verify energy conditions for subluminal case	KEEP	EC_status	All 4 conditions satisfied (NEC WEC SEC DEC)	0.85	0.92	Matter shell with M_ADM > 0 and bounded shift vector keeps momentum flux below energy density	Verified from paper: R1=10m, R2=20m, M=4.49e27 kg (2.365 Jupiter masses), v=0.04c. Numerical evaluation via Warp Factory confirms all EC satisfied.	False
E08	Can Fell-Heisenberg be extended to v > c?	KEEP	EC_status_superluminal	No: EC break at high shift	0.90	0.95	As shift vector magnitude increases, momentum flux exceeds energy density	The shift vector magnitude scales with v. At some critical v, the momentum flux T^{0i} exceeds energy density T^{00}, violating DEC then WEC. Superluminal extension impossible without exotic matter.	False
E09	Ford-Roman quantum inequality bound	KEEP	QI_bound	|Delta_E| * tau_0^4 <= 3/(32 pi^2) in natural units	0.85	0.88	QFT bound on negative energy density integrated over sampling time tau_0	For massless scalar field in 4D: max negative energy density ~ hbar/(tau_0^4 c^5). For tau_0 = 1 second, max |Delta_E| ~ 10^{-103} J/m^3. For Planck time, max |Delta_E| ~ 10^{113} J/m^3 but only for ~10^{-44} s.	False
E10	Casimir energy density at 1 micrometre separation	KEEP	E_Casimir	-1.3e-3 J/m^3	0.95	0.96	E = -pi^2 hbar c / (720 d^4) for parallel plates separation d	At d = 1e-6 m: E = -pi^2 * 1.055e-34 * 3e8 / (720 * 1e-24) = -1.3e-3 J/m^3. Confirmed by Lamoreaux (1997) and Mohideen-Roy (1998) experiments.	False
E11	Casimir energy vs Alcubierre requirements	KEEP	E_ratio	~10^{60} shortfall	0.95	0.97	Ratio of available Casimir E to required Alcubierre E	Alcubierre requires E ~ v^2 c^2 / (G R^2) ~ 10^{57} J/m^3 for R=1m v=c. Casimir gives ~10^{-3} J/m^3. Ratio = 10^{60}. No geometric optimisation bridges this gap.	False
E12	GWTC-3 gravitational wave constraints	KEEP	detection_threshold	No anomalous signals in 90 events	0.40	0.35	Warp bubble collapse produces characteristic GW waveform (Clough et al 2024)	GWTC-3 events are all consistent with compact binary mergers (BBH, BNS, NSBH). No residuals suggesting exotic spacetime geometry. Constrains any macroscopic warp event within LIGO sensitivity volume (~100 Mpc for BBH).	False
E13	NANOGrav stochastic background constraints	KEEP	spectral_consistency	Consistent with SMBH binary population	0.30	0.25	Large-scale metric deformations would modify stochastic GW spectrum	NANOGrav 15-yr spectrum is consistent with f^{-2/3} characteristic strain expected from SMBH binaries. No excess at any frequency that would indicate exotic metric deformations. Not a strong direct constraint on warp drives but rules out cosmological-scale effects.	False
E14	Chronology protection: does every FTL metric create CTCs?	KEEP	CTC_universality	Yes for all known superluminal warp metrics	0.80	0.88	Everett (1996): two superluminal trajectories create CTC; Shoshany (2023): any Lentz-type superluminal warp enables time travel	Every known superluminal warp metric either directly creates CTCs or can be configured to do so. Subluminal metrics (Fell-Heisenberg) do NOT create CTCs. The dividing line is precisely v=c.	False
E15	Krasnikov tube exotic matter requirements	KEEP	M_exotic	>> M_sun (scales with tube length L)	0.70	0.78	Extended structure requires exotic matter per unit length	Everett-Roman (1997): Krasnikov tube of length L requires M_exotic ~ L * M_Alcubierre/R. For L = 1 light-year, M_exotic ~ 10^{46} kg ~ 10^{16} M_sun. Vastly exceeds Alcubierre.	False
E16	Morris-Thorne wormhole exotic matter	KEEP	M_exotic	~M_Planck to M_sun depending on throat radius	0.65	0.72	Throat radius r_0 sets minimum exotic matter via flare-out condition	For traversable wormhole with r_0 = 1 m: M_exotic ~ c^4 r_0 / G ~ 10^{27} kg ~ 0.5 M_Jupiter. For human-traversable (r_0 ~ 1 m), need ~ Jupiter mass of exotic matter. Visser-Kar-Dadhich (2003) showed this can be made arbitrarily small but requires fine-tuning.	False
E17	Systematic debunking of 'warp without exotic matter' claims	KEEP	claim_validity	All superluminal claims invalid; subluminal (Fell-Heisenberg) valid	0.80	0.90	Claims: Lentz (refuted by Celmaster), Fell-Heisenberg (valid but subluminal only), White (measured Casimir not warp), various online claims (no peer review)	4 major claims analysed: (1) Lentz 2021 -- refuted, (2) Fell-Heisenberg 2024 -- valid but subluminal, (3) White/Eagleworks -- measured Casimir, (4) Fell-Heisenberg 2021 (earlier paper) -- geometric structure, also subluminal only.	False
E18	White/NASA Eagleworks experiment analysis	KEEP	signal_source	Casimir effect (not warp field)	0.85	0.92	Custom Casimir cavity geometry produces negative energy ~10^{-9} J/m^3	White (2021) reported warp-field-like Casimir geometry. The measured signal (~10^{-9} J/m^3) is consistent with Casimir effect predictions and is 10^{60} too small for any warp effect. Not independently replicated.	False
E19	Energy condition hierarchy for warp drives	KEEP	hierarchy	NEC most fundamental; DEC most restrictive	0.75	0.82	NEC ⊂ WEC ⊂ DEC (set containment of satisfied matter); SEC independent	For warp drives: NEC violation is NECESSARY for superluminal (Olum 1998). WEC violation follows from NEC violation. DEC is most restrictive (requires rho >= |p_i|). SEC is independent (violated by Lambda > 0 but that doesn't help warp). Ranking: NEC (fundamental barrier) > DEC (tightest constraint on subluminal) > WEC > SEC.	False
E20	Subluminal warp drive vs rocket comparison	KEEP	mass_advantage	No practical advantage at current parameters	0.70	0.75	Fell-Heisenberg needs 2.365 M_Jupiter for v=0.04c; rocket needs far less	Tsiolkovsky: mass ratio = exp(dv/v_exhaust). For v=0.04c with nuclear pulse (v_exhaust ~ 0.03c), mass ratio ~ exp(1.3) ~ 3.7. For warp: need 2.365 Jupiter masses. Rocket wins by ~10^{25} in mass efficiency. Warp advantage is geodesic transport (zero g-force) not mass efficiency.	False
INT1	Interaction: Fell-Heisenberg mass scaling with velocity + energy condition threshold	KEEP	mass_velocity_scaling	M_min ~ v^2 / v_max^2 * M_base; EC threshold at v_max ~ 0.1c	0.50	0.65	Shift vector ~ v; momentum flux ~ v^2; EC breaks when flux exceeds density	Combining E07 + E08: The shell mass required scales as v^2 for fixed geometry. The EC break point depends on shell density profile. For the demonstrated geometry, v_max for EC satisfaction is ~ 0.1c (estimate). At v=0.1c, M ~ 6.25 * M_base ~ 15 Jupiter masses.	True
INT2	Interaction: chaining subluminal bubbles + CTC avoidance	KEEP	chaining_feasibility	Possible in principle but mass requirements multiply	0.40	0.50	Sequential subluminal bubbles each require full mass; CTCs avoided since each is subluminal	Combining E14 + E20: chaining N subluminal bubbles requires N * M_shell total mass. No CTC issues since each segment is subluminal. Total transit time > L/c (no FTL advantage). Mass cost: N * 2.365 M_Jupiter per bubble. Practically worse than single-stage.	True
T01	Energy-condition taxonomy framework	KEEP	framework_quality	Comprehensive: 4 conditions x 8 metrics = 32 evaluations	-	-	Tournament entry: systematic EC evaluation as classification framework	Evaluated all 8 metrics against all 4 energy conditions. Clear separation: superluminal metrics violate NEC/WEC universally; Fell-Heisenberg subluminal satisfies all 4.	False
T02	Alcubierre parameter-space exploration framework	KEEP	framework_quality	3D parameter space (v, R, sigma) mapped to M_exotic	-	-	Tournament entry: parameter sweep of Alcubierre metric	M_exotic(v, R, sigma) = v^2 R / G * f(sigma R). Explored v=[0.01c, 10c], R=[1m, 1000m], sigma=[1/m, 100/m]. Confirms M_exotic >> M_sun for all superluminal cases.	False
T03	Quantum inequality bounds framework	KEEP	framework_quality	Ford-Roman bound successfully constrains all warp proposals	-	-	Tournament entry: QI as constraint framework	QI bound: |Delta_E| <= C / tau_0^4. Applied to Alcubierre, Natario, Krasnikov, Morris-Thorne. All require Planck-thickness walls → universe-mass energies. Most restrictive single constraint.	False
T04	Observational-constraint framework	REVERT	framework_quality	Insufficient: no positive constraints from current data	-	-	Tournament entry: GW + cosmic ray constraints on warp	Current GW data (GWTC-3, NANOGrav) provides null results only. No positive constraints that distinguish between warp models. Framework valid but uninformative at current sensitivity. Reverted as not yet useful.	False
T05	Fell-Heisenberg boundary analysis framework	KEEP	framework_quality	Clear v < c boundary identified with quantitative scaling	-	-	Tournament entry: mapping subluminal→superluminal transition	Analysis of EC satisfaction as function of v shows clear transition at v ~ 0.1c (for demonstrated geometry) where momentum flux exceeds energy density. Most informative framework for understanding what 2024 solution achieves.	False
DISC1	Phase B: Complete warp metric catalogue	DISCOVERY	catalogue_size	10 metrics catalogued with full EC evaluation	-	-	Systematic extraction and computation from papers	Output: discoveries/warp_metric_catalogue.csv	False
DISC2	Phase B: Energy requirements across metrics and parameters	DISCOVERY	parameter_coverage	6 metrics x 4 parameter sets = 24 energy computations	-	-	Analytical and order-of-magnitude calculations	Output: discoveries/energy_requirements.csv	False
DISC3	Phase B: Observational constraints summary	DISCOVERY	constraint_count	5 observational channels evaluated	-	-	Literature survey of detection capabilities	Output: discoveries/observational_constraints.csv	False
RV01	Verify Olum (1998) proves WEC violation (not NEC) for superluminal travel; state assumptions (global hyperbolicity, achronal hypersurface)	RUN_RV	claim_accuracy	Olum proves WEC violation required; Santiago et al. proves NEC for Natario class	0.95	0.98	Olum (1998) PRL 81 3567: theorem requires WEC under global hyperbolicity; Santiago et al. (2022) PRD 105 064038: NEC for zero-vorticity Natario class	Paper conflated Olum (WEC) with Santiago (NEC). Corrected: Olum = WEC + assumptions; Santiago = NEC + Natario class scope.	False
RV02	Verify Celmaster-Rubin (2025) peer-review status	RUN_RV	publication_status	Preprint only (arXiv:2511.18251v1, Nov 2025)	0.95	0.95	Checked arXiv metadata and journal databases	No journal publication found as of 2026-04-16. Paper remains an unreviewed preprint. Catalogue updated with peer_reviewed column.	False
RV03	Verify squeezed-vacuum and other QFT negative energy mechanisms are bounded by quantum inequalities	RUN_RV	QI_universality	All known QFT negative energy sources (Casimir, squeezed vacuum, dynamical Casimir) bounded by Ford-Roman / Fewster QI	0.90	0.95	Fewster (2012) arXiv:1208.5399; Kontou-Sanders (2020) CQG 37 193001: QI bounds are universal for minimally coupled quantum fields	The 10^60 gap applies to ALL known QFT negative energy mechanisms, not just parallel-plate Casimir. Squeezed states produce higher peak negative E but for shorter durations; product bounded.	False
RV04	Add peer_reviewed column to warp_metric_catalogue.csv	RUN_RV	catalogue_completeness	Column added with values for all 10 entries	-	-	Cross-referenced each source against journal databases	Added: Yes (CQG), Yes (PRD), Preprint, etc. for each catalogue entry.	False
RV05	Expand research_queue.md to >= 100 hypotheses	RUN_RV	queue_size	105 hypotheses (H001-H105)	-	-	Added hypotheses covering: parameter sensitivity, modified gravity, higher dimensions, QFT mechanisms, stability, observational signatures, computational verification, thermodynamics	70 new hypotheses added spanning 10 thematic categories.	False
DIAG01	Cross-check 10^60 gap claim against universal quantum inequality bound	DIAG	gap_universality	Confirmed: QI bound |Delta_E|*tau^4 <= C applies universally; 10^60 gap holds for all known negative energy sources	0.95	0.97	Ford-Roman QI for scalar field; Fewster generalisation to arbitrary quantum fields in curved spacetime	Even squeezed vacuum at optimal squeezing: peak |Delta_E| ~ 10^37 J/m^3 (at atomic scale) but duration ~ 10^{-44} s (Planck time). Integrated negative energy vanishingly small. Gap confirmed.	False
