id,title,authors,year,venue,doi_or_url,category,relevance
203,"Feature selection for high-dimensional data: A fast correlation-based filter solution","Yu L; Liu H",2003,"International Conference on Machine Learning","ICML-2003","ml_methods","Feature selection methods for high-dimensional data"
204,"Receiver Operating Characteristic Analysis","Fawcett T",2006,"Pattern Recognition Letters","doi:10.1016/j.patrec.2005.10.010","statistics","ROC analysis methodology"
205,"Ensemble methods: Bagging boosting and stacking","Opitz D; Maclin R",1999,"Journal of Artificial Intelligence Research","doi:10.1613/jair.614","ml_methods","Foundation of ensemble methods"
206,"Stacked Generalization","Wolpert DH",1992,"Neural Networks","doi:10.1016/S0893-6080(05)80023-1","ml_methods","Original stacking ensemble paper"
207,"Comparison of oversampling and undersampling methods for imbalanced time-series classification","Xie J; et al",2023,"Neural Computing and Applications","doi:10.1007/s00521-023-08268-y","statistics","Sampling strategies for imbalanced time series"
208,"Balanced Random Forests","Chen C; Liaw A; Breiman L",2004,"Machine Learning","doi:10.1023/B:MACH.0000035475.91501.4f","ml_methods","Random forests adapted for imbalanced data"
209,"Calibration of Probabilities: A Critical Review","Niculescu-Mizil A; Caruana R",2005,"ICML","doi:10.1145/1102351.1102430","ml_methods","Probability calibration for classifiers"
210,"Frequency control and wind turbine technologies","Ela E; et al",2014,"NREL Technical Report","https://docs.nrel.gov/docs/fy14osti/60511.pdf","frequency_stability","NREL report on frequency control with wind turbines"
