id,title,authors,year,venue,url,category,relevance
P001,"Power System Stability and Control",Kundur P.,1994,McGraw-Hill,https://doi.org/10.1049/ep.1994.0319,textbook,Canonical reference for all power system stability phenomena
P002,"Power System Dynamics: Stability and Control",Machowski J. Bialek J. Bumby J.,2020,Wiley,https://doi.org/10.1002/9781119526346,textbook,Modern comprehensive treatment of electromechanical dynamics
P003,"Renewable Energy: Physics Engineering and Policy",Boyle G.,2012,Oxford University Press,https://global.oup.com/academic/product/9780199545339,textbook,Fundamentals of wind and solar generation physics
P004,"Electric Power Systems",Weedy B. Cory B. Jenkins N. Ekanayake J. Strbac G.,2012,Wiley,https://doi.org/10.1002/9781118361085,textbook,Standard UK/European power systems textbook
P005,"Power Electronics: Converters Applications and Design",Mohan N. Undeland T. Robbins W.,2003,Wiley,https://www.wiley.com/en-us/9780471226932,textbook,Reference for inverter control theory
P006,"Convex Optimization",Boyd S. Vandenberghe L.,2004,Cambridge University Press,https://web.stanford.edu/~boyd/cvvxbook/,textbook,Optimization foundations for OPF problems
P007,"Power System Analysis and Design",Glover J. Sarma M. Overbye T.,2017,Cengage,https://www.cengage.com/c/power-system-analysis-and-design-6e-glover/,textbook,Standard US power systems textbook including N-1 analysis
P008,"Grid-Forming Converters: State of the Art and Future Directions",Rosso R. Wang X. Liserre M. Lu X. Engelken S.,2021,IEEE Journal of Emerging and Selected Topics in Power Electronics,https://doi.org/10.1109/JESTPE.2021.3062949,review,Comprehensive review of grid-forming vs grid-following inverter control
P009,"A Review of Virtual Inertia Techniques for Renewable Energy-Based Power Systems",Fernandez-Guillimon A. Gomez-Lazaro E. Muljadi E. Molina-Garcia A.,2019,Renewable and Sustainable Energy Reviews,https://doi.org/10.1016/j.rser.2018.09.029,review,Synthetic inertia methods survey
P010,"Cascading Failure in Complex Networks",Buldyrev S. Parshani R. Paul G. Stanley H. Havlin S.,2010,Nature,https://doi.org/10.1038/nature08932,review,Foundational paper on interdependent network cascading failure theory
P011,"Power System Frequency Stability and Control: Survey of Literature and Industrial Practices",Eto J. et al.,2018,Lawrence Berkeley National Laboratory,https://doi.org/10.2172/1465978,review,DOE-funded comprehensive survey of frequency stability practices
P012,"Review of Voltage Stability Indices",Modarresi J. Gholipour E. Khodabakhshian A.,2016,Renewable and Sustainable Energy Reviews,https://doi.org/10.1016/j.rser.2016.01.016,review,Survey of all major voltage stability indices with comparison
P013,"A Survey on Cascading Failures in Power Systems",Vaiman M. et al.,2012,IEEE Transactions on Power Systems,https://doi.org/10.1109/TPWRS.2011.2169818,review,Foundational survey of cascading failure mechanisms in grids
P014,"Frequency Stability of Power Systems with High Penetrations of Renewables",Milano F. Dorfler F. Hug G. Hill D. Verbic G.,2018,Proceedings of the IEEE,https://doi.org/10.1109/JPROC.2018.2837880,review,Key review linking renewable penetration to frequency stability decline
P015,"Review of Challenges and Research Opportunities for Voltage Control in Smart Grids",Antoniadou-Plytaria K. Kouveliotis-Lysikatos I. Hatziargyriou N.,2017,IEEE Transactions on Smart Grid,https://doi.org/10.1109/TSG.2016.2597677,review,Voltage control challenges with distributed generation
P016,"System Strength and Security of Supply in High-Renewable Power Systems: A Review",Kenyon R. Bialek J.,2020,IEEE Access,https://doi.org/10.1109/ACCESS.2020.3040244,review,System strength metrics and minimum requirements
P017,"Review of System Strength and Short Circuit Ratio Definitions for Inverter-Based Resources",NERC,2023,NERC Technical Report,https://www.nerc.com/comm/RSTC/Pages/default.aspx,review,North American industry definitions of SCR and system strength
P018,"The 2003 Italian Blackout: System Restoration and Assessment of the Events",Berizzi A.,2004,IEEE Power Engineering Society General Meeting,https://doi.org/10.1109/PES.2004.1373131,historical_blackout,Canonical technical analysis of 2003 Italy blackout
P019,"Final Report of the Investigation Committee on the 28 September 2003 Blackout in Italy",UCTE,2004,UCTE Investigation Report,https://www.entsoe.eu/,historical_blackout,Full UCTE investigation including cascade sequence
P020,"Final Report on the August 14 2003 Blackout in the United States and Canada",US-Canada Power System Outage Task Force,2004,Government Report,https://www.energy.gov/oe/downloads/blackout-2003-final-report,historical_blackout,Canonical 2003 US-Canada blackout analysis
P021,"The 2006 European Blackout: From Grid Splitting to Restoration",UCTE,2007,UCTE Final Report,https://www.entsoe.eu/,historical_blackout,Analysis of November 2006 European frequency split
P022,"9 August 2019 Power Outage Report",Ofgem,2020,Ofgem Investigation Report,https://www.ofgem.gov.uk/publications/investigation-9-august-2019-power-outage,historical_blackout,UK blackout from generator trips revealing inverter vulnerabilities
P023,"Review of the February 2021 Electricity Crisis in Texas",Busby J. et al.,2021,Joule,https://doi.org/10.1016/j.joule.2021.03.021,historical_blackout,Analysis of Texas winter storm Uri grid collapse
P024,"The Iberian Blackout and Frequency Stability in Power Systems with High Renewable Energy Source Penetration",Thlon M. Brozek P.,2025,SSRN,https://papers.ssrn.com/sol3/papers.cfm?abstract_id=5285068,iberian_blackout,Early academic analysis of 28 April 2025 Iberian blackout
P025,"ENTSO-E Expert Panel Final Report on the 28 April 2025 Iberian Peninsula Blackout",ENTSO-E,2026,ENTSO-E Publication,https://www.entsoe.eu/publications/blackout/28-april-2025-iberian-blackout/,iberian_blackout,Canonical 440-page investigation identifying systemic failures
P026,"Interim Report on the Iberian Peninsula Power System Disturbance of 28 April 2025",ENTSO-E,2025,ENTSO-E Publication,https://www.entsoe.eu/news/2025/07/30/entso-e-publishes-interim-report-on-iberian-power-system-separation-of-28-april-2025/,iberian_blackout,First official technical analysis of the cascade sequence
P027,"System Non-Synchronous Penetration: Definition and Experience",EirGrid SONI,2014,EirGrid Technical Report,https://www.eirgridgroup.com/site-files/library/EirGrid/SNSP-Formula.pdf,frequency_stability,Defines the SNSP metric used by Irish grid operator
P028,"Rate of Change of Frequency (RoCoF) Review of TSO and Generator Recommendations",AEMO,2017,AEMO Report,https://www.aemo.com.au/-/media/files/electricity/nem/security_and_reliability/rocof/rocof-review.pdf,frequency_stability,Australian system operator RoCoF analysis and thresholds
P029,"Frequency Response and Inertia of the European Power System under the ENTSO-E Continental Europe Synchronous Area",ENTSO-E,2019,ENTSO-E Technical Report,https://www.entsoe.eu/,frequency_stability,Pan-European inertia and frequency response measurements
P030,"Impact of Low Rotational Inertia on Power System Stability and Operation",Tielens P. Van Hertem D.,2016,Renewable and Sustainable Energy Reviews,https://doi.org/10.1016/j.rser.2016.07.010,frequency_stability,Quantitative analysis of how declining inertia affects stability
P031,"Frequency Stability Evaluation Criteria for the Synchronous Zone of Continental Europe",Weissbach T. Welfonder E.,2009,European Transactions on Electrical Power,https://doi.org/10.1002/etep.328,frequency_stability,Defines frequency quality metrics for Continental Europe
P032,"Under-Frequency Load Shedding: An Overview",Gu W. Liu W. Zhu J. Zhao B.,2010,IEEE Transactions on Power Delivery,https://doi.org/10.1109/TPWRD.2009.2038700,frequency_stability,UFLS schemes theory and practice
P033,"Challenges of Operating High-Share Renewable Energy Systems",Denholm P. Mai T. Kenyon R. Kroposki B.,2021,NREL Technical Report,https://doi.org/10.2172/1785959,renewable_integration,NREL analysis of integration challenges at 50-100% RE
P034,"Integration of Large-Scale Renewable Energy into Bulk Power Systems",Ackermann T. et al.,2017,Springer,https://doi.org/10.1007/978-3-319-55581-2,renewable_integration,Engineering handbook for large-scale RE grid integration
P035,"Operating a Power System at Very High Penetrations of Variable Renewable Energy",Bird L. Lew D. Milligan M. et al.,2016,IEEE Power and Energy Magazine,https://doi.org/10.1109/MPE.2016.2573543,renewable_integration,Practical operational experience at high RE shares
P036,"Towards 100% Renewable Energy: Challenges and Strategies",Jacobson M. Delucchi M. et al.,2017,Joule,https://doi.org/10.1016/j.joule.2017.07.005,renewable_integration,100% RE system design proposals and critiques
P037,"Minimum Synchronous Inertia Requirements in Power Systems with High Renewable Penetration",Daly P. Flynn D. Cunniffe N.,2015,IEEE Power & Energy Society General Meeting,https://doi.org/10.1109/PESGM.2015.7286477,frequency_stability,Quantitative inertia requirements derivation
P038,"System Strength in the NEM Explained",AEMO,2020,AEMO Technical Report,https://www.aemo.com.au/-/media/files/electricity/nem/system-strength-explained.pdf,system_strength,Australian definition and measurement of system strength
P039,"Short Circuit Ratio for Multi-Infeed HVDC Systems",Xiao H. Li Y. Lan J. Yang B.,2021,IEEE Transactions on Power Delivery,https://doi.org/10.1109/TPWRD.2020.3023421,system_strength,Multi-infeed SCR calculation methods
P040,"Voltage Stability Analysis of Grids Connected to Wind Power Generation: A Review",Vittal E. O'Malley M. Keane A.,2010,Renewable and Sustainable Energy Reviews,https://doi.org/10.1016/j.rser.2010.03.037,voltage_stability,How wind generation affects voltage stability margins
P041,"Voltage Collapse: A Survey of Theory Methods and Industrial Practice",Van Cutsem T. Vournas C.,1998,IEEE Proceedings,https://doi.org/10.1109/5.736837,voltage_stability,Classic survey of voltage collapse mechanisms
P042,"PyPSA: Python for Power System Analysis",Brown T. Horsch J. Schlachtberger D.,2018,Journal of Open Research Software,https://doi.org/10.5334/jors.188,methods,Core paper for PyPSA framework
P043,"PyPSA-Eur: An Open Optimisation Model of the European Transmission System",Horsch J. Hofmann F. Schlachtberger D. Brown T.,2018,Energy Strategy Reviews,https://doi.org/10.1016/j.esr.2018.08.012,methods,European grid model built on PyPSA
P044,"Optimal Power Flow: An Introduction",Frank S. Steponavice I. Rebennack S.,2012,Energy Systems,https://doi.org/10.1007/s12667-012-0056-z,methods,Survey of OPF formulations and solution methods
P045,"Security-Constrained Optimal Power Flow: A Review",Capitanescu F.,2016,European Journal of Operational Research,https://doi.org/10.1016/j.ejor.2015.09.007,methods,SCOPF formulations for N-1 contingency
P046,"Machine Learning for Power System Stability Assessment: A Comprehensive Review",Zhang Y. et al.,2021,IEEE Transactions on Power Systems,https://doi.org/10.1109/TPWRS.2020.3042505,ml_power,Survey of ML approaches to stability assessment
P047,"Real-Time Stability Assessment in Modern Power System Control Centers",Makarov Y. et al.,2012,IEEE Transactions on Power Systems,https://doi.org/10.1109/TPWRS.2012.2208253,ml_power,Operational real-time stability screening methods
P048,"Data-Driven Prediction of Power System Frequency",Kruse J. Schafer B. Witthaut D.,2021,IEEE Access,https://doi.org/10.1109/ACCESS.2021.3107886,ml_power,ML prediction of frequency dynamics from grid state
P049,"Deep Learning for Power System Security Assessment",Duchesne L. Karangelos E. Wehenkel L.,2020,Electric Power Systems Research,https://doi.org/10.1016/j.epsr.2019.106030,ml_power,Deep learning approaches to dynamic security
P050,"Predicting Power System Instability through Early Warning Signals",Podolsky I. et al.,2021,Nature Communications,https://doi.org/10.1038/s41467-021-26603-0,ml_power,Critical slowing down as early warning for grid collapse
P051,"A Taxonomy of Cascading Failures in Power Systems",Papic M. et al.,2011,IEEE PES General Meeting,https://doi.org/10.1109/PES.2011.6039283,cascading_failure,Classification of cascade mechanisms
P052,"Influence Graphs for Cascading Failure Analysis of Power Grids",Nakarmi U. Rahnamay-Naeini M.,2020,IEEE Transactions on Power Systems,https://doi.org/10.1109/TPWRS.2019.2948083,cascading_failure,Graph-based cascade propagation analysis
P053,"Cascading Failures in Power Grids: Analysis and Algorithms",Soltan S. Mazauric D. Zussman G.,2017,ACM SIGMETRICS,https://doi.org/10.1145/3078505.3078540,cascading_failure,Algorithms for cascade prediction
P054,"Hidden Failures: A Major Threat to Grid Reliability",Chen J. Thorp J. Dobson I.,2005,IEEE Power and Energy Magazine,https://doi.org/10.1109/MPAE.2005.1405870,cascading_failure,Hidden protection failures amplifying cascades
P055,"Branching Process Models for the Exponentially Increasing Portions of Cascading Failure Blackouts",Dobson I. Carreras B. Newman D.,2005,Proceedings of the 38th Hawaii International Conference on System Sciences,https://doi.org/10.1109/HICSS.2005.14,cascading_failure,Stochastic cascade models
P056,"Risk Assessment of Cascading Outages: Methodologies and Challenges",Kirschen D. Jayaweera D.,2004,IEEE Transactions on Power Systems,https://doi.org/10.1109/TPWRS.2004.825919,cascading_failure,Risk assessment frameworks for cascading outages
P057,"OPA: An Agent-Based Model for Power Grid Cascading Failure Analysis",Carreras B. Lynch V. Dobson I. Newman D.,2004,IEEE Transactions on Power Systems,https://doi.org/10.1109/TPWRS.2004.825918,cascading_failure,OPA cascade simulation model
P058,"Complex Systems Analysis of Series of Blackouts: Cascading Failure Critical Points and Self-Organization",Dobson I. Carreras B. Lynch V. Newman D.,2007,Chaos,https://doi.org/10.1063/1.2737822,cascading_failure,Self-organized criticality in power grid blackouts
P059,"Investigation of the Turkish Blackout on 31 March 2015",ENTSO-E,2015,ENTSO-E Investigation Report,https://www.entsoe.eu/,historical_blackout,Another European blackout with renewable-related aspects
P060,"System Disturbance on 4 November 2006: Final Report",UCTE,2007,UCTE Report,https://www.entsoe.eu/,historical_blackout,4 November 2006 European frequency split detailed timeline
P061,"South Australian Blackout of 28 September 2016: Third Preliminary Report",AEMO,2017,AEMO Report,https://www.aemo.com.au/energy-systems/electricity/national-electricity-market-nem/nem-events-and-reports,historical_blackout,Inverter-dominated grid failure in South Australia
P062,"Fault Ride-Through Requirements and Grid Code Compliance of Inverter-Based Resources",NERC,2022,NERC Reliability Guideline,https://www.nerc.com/comm/RSTC/Pages/default.aspx,inverter_control,Inverter fault ride-through standards
P063,"Grid-Following Inverters and Synchronous Condensers: The Role of Conventional Plant During the Energy Transition",Pagnani D. et al.,2020,Energies,https://doi.org/10.3390/en13184022,inverter_control,Role of synchronous condensers in inverter-dominated grids
P064,"Virtual Synchronous Generator: A Comprehensive Overview",Beck H. Hesse R.,2007,VDE Congress,https://doi.org/10.1109/ISIE.2007.4374678,inverter_control,Virtual synchronous generator concept
P065,"Droop Control: A Method for Parallel Operation of Inverters",Guerrero J. et al.,2004,IEEE Transactions on Industrial Electronics,https://doi.org/10.1109/TIE.2004.840167,inverter_control,Foundation paper for inverter droop control
P066,"Generic Models and Model Validation for Wind and Solar PV Generation",WECC,2014,WECC Report,https://www.wecc.org/Reliability/GenericModelDocumentation.pdf,methods,Standard dynamic simulation models for renewables
P067,"Definition and Classification of Power System Stability",Kundur P. et al.,2004,IEEE Transactions on Power Systems,https://doi.org/10.1109/TPWRS.2004.825981,frequency_stability,IEEE/CIGRE joint task force stability definitions
P068,"Experience with Provision of Synthetic Inertia from Wind Power",EirGrid SONI,2015,EirGrid SONI Consultation,https://www.eirgridgroup.com/,frequency_stability,Irish operational experience with synthetic inertia
P069,"Inertia Estimation of the GB Power System Using Synchrophasor Measurements",Ashton P. Taylor G. Irving M. Carter A. Bradley M.,2015,IEEE Transactions on Power Systems,https://doi.org/10.1109/TPWRS.2014.2333776,frequency_stability,Real-time inertia estimation from PMU data
P070,"Renewable Energy Sources in the Spanish Electricity Market: A Review",Ciarreta A. Gutierrez-Hita C. Nasirov S.,2011,Renewable and Sustainable Energy Reviews,https://doi.org/10.1016/j.rser.2011.07.150,iberian_context,Spanish electricity market structure and RE evolution
P071,"The Spanish Power System: Status and Future Trends",REE,2024,Red Electrica Annual Report,https://www.ree.es/en/datos/publications,iberian_context,Latest REE overview of Spanish grid structure
P072,"Portuguese Power System and the Role of Renewables",REN,2024,REN Annual Report,https://www.ren.pt/en/what-we-do/electricity/market-data,iberian_context,Portuguese grid operator system overview
P073,"Interconnection Capacity Between Spain and France: Planning and Challenges",ENTSO-E,2022,TYNDP Report,https://tyndp.entsoe.eu/,iberian_context,Spain-France interconnection capacity analysis
P074,"The Role of Battery Energy Storage in Low-Inertia Power Systems",Fang J. Li H. Tang Y. Blaabjerg F.,2019,IEEE Transactions on Power Systems,https://doi.org/10.1109/TPWRS.2019.2929975,energy_storage,Battery storage for inertia provision
P075,"Wind Turbine Clustering and Curtailment Control",Gu M. et al.,2018,Renewable Energy,https://doi.org/10.1016/j.renene.2018.03.048,renewable_integration,Wind curtailment strategies affecting grid stability
P076,"Impact of Solar PV on Voltage Regulation in Distribution Networks",Tonkoski R. Lopes L. El-Fouly T.,2012,IEEE Transactions on Sustainable Energy,https://doi.org/10.1109/TSTE.2012.2195169,voltage_stability,Solar PV voltage regulation impacts
P077,"Reactive Power Management of Power Networks with Wind Generation",Meegahapola L. Flynn D. Kennedy J.,2011,Springer,https://doi.org/10.1007/978-1-4614-1385-4,voltage_stability,Reactive power management with wind generation
P078,"N-1 Security Constrained Unit Commitment with Corrective Actions",Fu Y. Shahidehpour M.,2009,IEEE Transactions on Power Systems,https://doi.org/10.1109/TPWRS.2008.2008133,methods,N-1 contingency in commitment optimization
P079,"Online Assessment of Voltage Stability",Ajjarapu V. Christy C.,1992,IEEE Transactions on Power Systems,https://doi.org/10.1109/59.141711,voltage_stability,Continuation power flow for voltage stability
P080,"Modal Analysis for Voltage Stability",Gao B. Morison G. Kundur P.,1992,IEEE Transactions on Power Systems,https://doi.org/10.1109/59.207377,voltage_stability,Eigenvalue-based voltage stability methods
P081,"An Energy Approach to Static Voltage Stability",Overbye T. DeMarco C.,1995,IEEE Transactions on Power Systems,https://doi.org/10.1109/59.387921,voltage_stability,Energy function methods for voltage stability
P082,"The Relationship Between Electricity Spot Prices and Grid Frequency",Schafer B. et al.,2018,Nature Energy,https://doi.org/10.1038/s41560-017-0058-z,frequency_stability,Empirical frequency-price relationship in European grids
P083,"Frequency Fluctuations in Power Grids: A Stochastic Approach",Anvari M. et al.,2016,Scientific Reports,https://doi.org/10.1038/srep35978,frequency_stability,Stochastic frequency dynamics modelling
P084,"Non-Gaussian Power Grid Frequency Fluctuations Characterized by Levy-Stable Laws and Superstatistics",Schafer B. et al.,2018,Nature Energy,https://doi.org/10.1038/s41560-017-0058-z,frequency_stability,Statistical characterization of frequency fluctuations
P085,"Analysis of the Continental European Power System Frequency During the 4 November 2006 Disturbance",Weissbach T.,2009,European Transactions on Electrical Power,https://doi.org/10.1002/etep.328,historical_blackout,Frequency dynamics during 2006 European split
P086,"The Statistical Physics of Power Grids: Modelling and Analysis",Witthaut D. et al.,2022,Reviews of Modern Physics,https://doi.org/10.1103/RevModPhys.94.015005,methods,Statistical physics approaches to power grid analysis
P087,"Microgrids: Architecture and Control",Olivares D. et al.,2014,IEEE Transactions on Smart Grid,https://doi.org/10.1109/TSG.2013.2294402,renewable_integration,Microgrid concepts relevant to grid islanding
P088,"Impact of Distributed Generation on Power System Transient Stability",Khatod D. Pant V. Sharma J.,2010,International Journal of Electrical Power and Energy Systems,https://doi.org/10.1016/j.ijepes.2009.12.005,renewable_integration,DG effects on transient stability margins
P089,"The Role of HVDC in Managing Future European Power Systems",Van Hertem D. Ghandhari M.,2010,IEEE Transactions on Power Systems,https://doi.org/10.1109/TPWRS.2010.2042753,iberian_context,HVDC interconnector role in European system
P090,"Generation Adequacy and Firm Capacity in a System with a High Renewable Share",Keane A. et al.,2011,IEEE Transactions on Power Systems,https://doi.org/10.1109/TPWRS.2011.2164944,renewable_integration,Adequacy and firm capacity with high renewables
P091,"Critical Slowing Down as Early Warning for the Onset and Termination of Depression",Wichers M. et al.,2016,Proceedings of the National Academy of Sciences,https://doi.org/10.1073/pnas.1312114110,cross_domain,Critical slowing down theory applicable to grid dynamics
P092,"Anticipating Critical Transitions",Scheffer M. et al.,2012,Science,https://doi.org/10.1126/science.1225244,cross_domain,Generic early warning signals for complex system transitions
P093,"Early-Warning Signals for Critical Transitions",Scheffer M. et al.,2009,Nature,https://doi.org/10.1038/nature08227,cross_domain,Foundational paper on early warning signals in complex systems
P094,"XGBoost: A Scalable Tree Boosting System",Chen T. Guestrin C.,2016,Proceedings of the 22nd ACM SIGKDD,https://doi.org/10.1145/2939672.2939785,methods,XGBoost method paper
P095,"LightGBM: A Highly Efficient Gradient Boosting Decision Tree",Ke G. et al.,2017,NeurIPS,https://papers.nips.cc/paper/2017/hash/6449f44a102fde848669bdd9eb6b76fa,methods,LightGBM method paper
P096,"Extremely Randomized Trees",Geurts P. Ernst D. Wehenkel L.,2006,Machine Learning,https://doi.org/10.1007/s10994-006-6226-1,methods,ExtraTrees method paper
P097,"Power System Protection: Principles and Practice",Anderson P.,1999,IEEE Press,https://doi.org/10.1109/9780470545584,textbook,Protection relay theory and coordination
P098,"Applied Predictive Modeling",Kuhn M. Johnson K.,2013,Springer,https://doi.org/10.1007/978-1-4614-6849-3,textbook,Practical ML workflow including cross-validation strategies
P099,"The Renewable Energy Transition in the European Power Sector: Status Barriers and Solutions",Hirth L.,2013,Applied Energy,https://doi.org/10.1016/j.apenergy.2013.04.048,renewable_integration,Market value of renewables declining with penetration
P100,"Provision of Frequency Reserves from Wind Power Plants",De Almeida R. Lopes J. Barreiros J.,2007,Proceedings of the IEEE PES General Meeting,https://doi.org/10.1109/PES.2007.386086,frequency_stability,Wind provision of frequency response
P101,"ENTSO-E Transparency Platform: Fundamentals",ENTSO-E,2023,ENTSO-E Documentation,https://transparency.entsoe.eu/content/static_content/Static%20content/knowledge%20base/knowledge-base.html,data_source,Documentation for ENTSO-E data platform
P102,"Network Code on Requirements for Grid Connection of Generators",ENTSO-E,2016,EU Regulation 2016/631,https://eur-lex.europa.eu/legal-content/EN/TXT/?uri=CELEX%3A32016R0631,regulation,EU grid connection code for generators
P103,"Network Code on High Voltage Direct Current Connections",ENTSO-E,2016,EU Regulation 2016/1447,https://eur-lex.europa.eu/legal-content/EN/TXT/?uri=CELEX%3A32016R1447,regulation,HVDC connection codes
P104,"ENTSO-E Continental Europe Operation Handbook",ENTSO-E,2019,ENTSO-E Operations,https://www.entsoe.eu/publications/system-operations-reports/operation-handbook/,regulation,Operational procedures for Continental Europe area
P105,"Estimating the Renewable Energy Potential in Africa",IRENA,2015,IRENA Report,https://www.irena.org/publications/2015/,cross_domain,Methods for renewable potential estimation transferable to Iberia
P106,"The Value of Forecasting",Morales J. et al.,2014,International Journal of Forecasting,https://doi.org/10.1016/j.ijforecast.2013.02.002,methods,Value of probabilistic forecasting for grid operations
P107,"Probabilistic Forecasting of Wind Power Generation Losses",Bessa R. et al.,2012,Renewable Energy,https://doi.org/10.1016/j.renene.2011.10.019,methods,Portuguese wind power forecasting methods
P108,"Operating Reserve Determination Considering Rapid Increase of Renewable Energy",Ela E. et al.,2013,NREL Technical Report,https://doi.org/10.2172/1080281,frequency_stability,Reserve sizing with high renewables
P109,"Power System Oscillations",Rogers G.,2000,Kluwer Academic,https://doi.org/10.1007/978-1-4615-4561-3,textbook,Inter-area oscillations theory and damping
P110,"Oscillation Detection and Classification in Power Systems Using Wide-Area Monitoring",Trudnowski D. et al.,2008,IEEE Transactions on Power Systems,https://doi.org/10.1109/TPWRS.2008.926426,frequency_stability,PMU-based oscillation detection
P111,"Sub-Synchronous Resonance in Power Systems: A Review",IEEE Committee,1992,IEEE Transactions on Power Systems,https://doi.org/10.1109/59.141717,frequency_stability,Sub-synchronous oscillation mechanisms
P112,"Subsynchronous Oscillation in Full Converter Wind Turbines",Fan L. Miao Z.,2012,IEEE Transactions on Power Systems,https://doi.org/10.1109/TPWRS.2012.2190290,inverter_control,Subsynchronous oscillations from inverter-based resources
