id,authors,year,title,journal,theme,relevance
173,Irish Fiscal Advisory Council,2024,"Fiscal Assessment Report",IFAC,domain_fundamentals,Fiscal policy assessment
174,Crosby N et al,2018,"Will automated valuation models dehumanise property tax",Property Management,methodology,Automated valuation methods
175,BCIS,2024,"BCIS Online",Building Cost Information Service,materials_prices,UK construction cost database
176,Davis Langdon,2019,"Spon's Construction Cost Guide 2019",Taylor & Francis,materials_prices,Standard cost reference
177,Rawlinsons,2024,"Australian Construction Handbook",Rawlinsons,materials_prices,International cost reference
178,RSMeans,2024,"RSMeans Data Construction Cost Estimating",Gordian,materials_prices,US cost data reference
179,World Bank,2024,"World Development Indicators Construction",World Bank,domain_fundamentals,Cross-country construction data
180,IMF,2024,"Global Housing Watch",International Monetary Fund,price_cycles,Global housing price tracking
181,BIS,2024,"Property price statistics",Bank for International Settlements,price_cycles,International property prices
182,OECD,2024,"Affordable Housing Database",OECD,domain_fundamentals,Housing affordability data
183,UN Habitat,2024,"World Cities Report 2024",United Nations,domain_fundamentals,Global housing challenges
184,Eurostat,2024,"House Price Index",Eurostat,price_cycles,EU house price indices
185,Costello G & Watkins C,2002,"Towards a system of local house price indices",Housing Studies,methodology,Local price index methodology
186,Silver M,2016,"How to Better Measure Hedonic Residential Property Price Indexes",IMF Working Paper,methodology,Hedonic price methodology
187,Hill RJ,2013,"Hedonic price indexes for residential housing",Journal of Economic Surveys,methodology,Price index survey
188,Diewert WE et al,2015,"Decompositions of a House Price Index into Land and Structures Components",Econometric Reviews,methodology,Price decomposition methodology
189,de Haan J,2010,"Hedonic price indexes: a comparison of imputation Jevons and time-dummy hedonic approaches",Revue d'Économie Industrielle,methodology,Price index comparison
190,Coulson NE & McMillen DP,2008,"Estimating time space and time-space real estate price models",Real Estate Economics,methodology,Spatial price models
191,Kennedy G & McQuinn K,2011,"Why are Irish house prices still falling",Central Bank Economic Letters,domain_fundamentals,Irish house price analysis
192,Lyons R,2019,"Can we use residential building permissions to estimate housing supply",Journal of the Statistical and Social Inquiry Society,domain_fundamentals,Irish housing supply proxy
193,McCord M et al,2014,"Understanding rental prices in the UK",Journal of Financial Management of Property and Construction,domain_fundamentals,Rental market analysis
194,Stevenson S,2008,"Modelling housing market fundamentals",Housing Studies,price_cycles,Housing fundamental models
195,Abraham JM & Hendershott PH,1996,"Bubbles in metropolitan housing markets",Journal of Housing Research,price_cycles,Housing bubble identification
196,Mayer CJ & Somerville CT,2000,"Residential construction: using the urban growth model to estimate housing supply",Journal of Urban Economics,price_cycles,Housing supply estimation
197,Pheng LS & Chuan QT,2006,"Environmental factors and work performance of project managers in the construction industry",International Journal of Project Management,labour_market,Workforce productivity factors
198,Loosemore M & Andonakis N,2007,"Barriers to implementing OHS reforms – the experiences of small subcontractors",International Journal of Project Management,labour_market,Small firm compliance costs
199,Lingard H & Francis V,2009,"Managing Work-Life Balance in Construction",Spon Press,labour_market,Construction work-life balance
200,Dainty ARJ et al,2007,"The reality of sustainable construction education",Engineering Sustainability,labour_market,Workforce sustainability
201,BEC,2024,"Bi-monthly Construction Index",Business and Employers Confederation Ireland,materials_prices,Real-time cost tracking
202,AIB,2024,"AIB Construction Sector Outlook",Allied Irish Banks,domain_fundamentals,Banking perspective on construction
203,BOI,2024,"Bank of Ireland Property Report",Bank of Ireland,domain_fundamentals,Property market analysis
204,Savills,2024,"Irish Research Quarterly Q4 2024",Savills Ireland,domain_fundamentals,Property market research
205,CBRE,2024,"Ireland Construction Report",CBRE,domain_fundamentals,Commercial construction analysis
206,Cushman & Wakefield,2024,"Irish Market Report",C&W,domain_fundamentals,Market conditions
207,Knight Frank,2024,"Irish Residential Market Review",Knight Frank,domain_fundamentals,Residential market analysis
208,ESRI,2024,"Quarterly Economic Commentary Winter 2024",ESRI,domain_fundamentals,Macroeconomic outlook
209,CBI,2024,"Quarterly Bulletin Q4 2024",Central Bank of Ireland,domain_fundamentals,Financial stability assessment
210,Duffy D & Morley C,2023,"Construction sector output and employment projections",ESRI Research Note,domain_fundamentals,Sector projections
